,title,seller_name,description,initial_price,final_price,reviews_count,root_bs_rank,rating,bought_past_month,root_bs_category,bs_rank,country_of_origin
251,for Magsafe Car Mount?20 Strong Magnets? Magnetic Phone Holder for Car Phone Holder Mount Truck Dash?360°? Cell Phone Holders for Your Car Accessories for Women Men iPhone 16 Pro Max 15 14 13 12 Plus,Kai¦¦¦le ¦¦¦ect¦¦¦,"Why choose this 2-in-1 magsafe car mount ? Flexible vent mounts or super-sticky adhesive mounts mean you can find the most stable, suitable and convenient mount for any car model.The most cost-effective and convenient option.Each installation model is the best design on the market!   The super strong magnet can suck the cell phone in 1 second. Thus ensuring your driving safety!   Two different bases can meet the needs of multiple scenarios   1.Adhesive Holder mounting mode: Solve the non-stick problem real dashboard car phone mounting pattern. Installation of beautiful, variable viewing angle, stylish and does not take up space in the car, easy to find everyone's favorite installation perspective   2.Car Vent Holder Mode: Easy to install and remove!Steel hook material, permanent use, not like plastic hooks that have breaking problems and need to be replaced often.1 steel hook is more durable than 15 plastic hooks!   How to use this product!?1.This MagSafe Car Mount can be used directly on the iPhone 15/14/13/12 series without case or Magsafe case !No need for additional metal rings!2.Other cell phones or cases need to be glued to a product that comes with a metal ring in order to be used! Kaistyle Car Phone Holder Mount Wireless Charger Mount Add to Cart magsafe Car Charger Add to Cart Magsafe Car Mount Add to Cart Magsafe Car Mount Add to Cart Magnetic phone holder Add to Cart Magnetic Phone holder Add to Cart Customer Reviews 4.3 out of 5 stars 94 4.4 out of 5 stars 144 4.8 out of 5 stars 29 4.5 out of 5 stars 209 4.4 out of 5 stars 619 4.4 out of 5 stars 619 Price $19.99$19.99 $19.99$19.99 $9.99$9.99 $7.99$7.99 $9.99$9.99 $14.99$14.99 Wireless Charging ?? ?? — — — — Mounting Type ??Dash & Wind & Vent ??Dash & Vent ??Dash & Vent ??Dash & Vent ??Dash & Vent ??Vent Compatible Phones iPhone 16/15/14/13/12 Series iPhone 16/15/14/13/12 Series All Cellphones All Cellphones All Cellphones All Cellphones Magsafe ? Wireless Car Charger Mount ?? ?? ?? — — Special Feature Auto Clamping Strongest Magnets Strongest Magnets Strongest Magnets Strongest Magnets Strongest Magnets",15.0,9.99,5850,58,4.5,10000.0,Cell Phones & Accessories,2,
259,"Yoozon USB C to Lightning Adapter 2 Pack,Support 27W PD Fast Charging&Data Transfer,for Lightning to USB Type C Cable Adapter for iPhone/iPad/for Airpods,with Anti-Lost Loop,Not for Audio/OTG,Black",Yoo¦¦¦ St¦¦¦,"Only for ???????????????? and ???????? ???????????????? between the phone and computer, ?????? ?????? ??????????(????????????????????)/??????   27W PD Fast Charging The USB C to Lightning adapter supports PD fast charging up to 27W, efficient charging for less time.   Data Transfer Speed up to 480Mbps Only supports ???????????? ??????????-???????????????? data transfer. NOT work with Card Reader, Flash Drive, Square Reader, Mouse, Keyboard, Camera, Microphone, etc. (Note: Not support the headphone cable) Previous page Comes with 2 anti-lost loops,not easy to lose. Next page Yoozon Adapter Series Lighting to USBC Adapter Add to Cart USBC to Lightning Adapter Add to Cart USB C to USB Adapter Add to Cart USB to USB C Adapter Add to Cart USB A to USB C Adapter Add to Cart USB to USB C Adapter Buying Options Customer Reviews 4.4 out of 5 stars 513 4.2 out of 5 stars 281 4.7 out of 5 stars 540 4.6 out of 5 stars 562 4.7 out of 5 stars 250 4.8 out of 5 stars 37 Price $5.99$5.99 $4.49$4.49 $3.99$3.99 $3.99$3.99 $4.29$4.29 — For Headphones Not for Audio(Headphnes) Not for Audio(Headphones) v v v v For Data Transfer Not for OTG,Card Reader,etc Not for OTG,Card Reader,etc v v v v For Charging ? ? ? ? ? ? Material Aluminum Alloy Aluminum Alloy Aluminum Alloy Aluminum Alloy Aluminum Alloy Aluminum Alloy Quantity 2 Pack 2 Pack 3 Pack,4 Pack 3 Pack 4 Pack 4 Pack",5.99,5.99,513,10125,4.4,500.0,Cell Phones & Accessories,77,China
272,"FBB Phone Mount for Car, [ Off-Road Level Suction Cup Protection ] 3in1 Long Arm Suction Cup Holder Universal Cell Phone Holder Mount Dashboard Windshield Vent Compatible with All Smartphones",Zha¦¦¦lus¦¦¦,Previous page Next page,40.0,14.0,14849,1516,4.2,2000.0,Cell Phones & Accessories,66,
274,"Wireless Charger Compatible with iPhone 15 14 13 12 11 Pro Max/Mini/Plus/XR/X/8, 15W Max Fast Wireless Charging Pad Mat for Samsung Galaxy S23/S22/S21/S20/S10, Galaxy Buds",LIZ¦¦¦US?¦¦¦,"About this item Multiple Safty Protection - Built-in highly efficient components and intelligent chip, 15W fast charging stand provided with exclusive multiple advanced charging protection technologies, like temperature control, over-current protection, over-voltage protection and over-charging protection. Therefover wireless charger will never bother your sleep that you can have a good dream. Extensive Compatibility -15W fast charging mode for iPhone 16 15 14 13 12 Series/ Pro/ Pro Max/ mini/ SE 2020/11/11 Pro/11 Pro Max/X/XS/XS Max/XR/8/8+; 10W fast charging mode for Samsung S23/S22/S21/S20/S20+/Note 20/10/10+/S10/S10+/ S10E/ Note 9 and more; 7.5W standard charging mode for all other wireless-enabled Phones. (Note: Adapter is Not Included, QC3.0 adapter is needed for fast charge.) Ultra thin & Portable - Wireless charging pad is just 6.5mm super slim make it easier to put it in your pocket, more easier to be carried on anywhere.Type-c cables (included) allows wireless charger to charge in a faster rate. To charge your AirPods, please confirm it has wireless charging case. Smart Indicator Light Design - LED indicator of the fast wireless charging station helps you know charging status easily. Blue LED indicates your phone is in charging and the green LED indicates charging finished. The cyan lights flickered, indicating that the mobile phone and headphones are charged normally. Soft and unobtrusive light, suitable for bedside use. What You Get - 1X Wireless Charger Pad, 1X Type-C USB Charging Cable, 1X User Manual.You can consult us if you encounter any problems, We provide a 24-hour customer service. An ideal Present - As a perfect Christmas gift, Secret Santa present, New Year gift, or birthday present for him or her, your family, friends, and someone you love. › See more product details",9.99,9.99,1194,2364,4.1,1000.0,Cell Phones & Accessories,68,China
278,"LISEN Cell Phone Stand Adjustable Phone Holer for Desk, Computer Office Desk Accessories for iPhone 16 Holder Women Kitchen Essentials Fits All Mobile Phones Switch Kindle iPads Tablet 4-10in",LIS¦¦¦Dir¦¦¦,The video showcases the product in use.The video guides you through product setup.The video compares multiple products.The video shows the product being unpacked.,8.99,8.99,66178,247,4.5,9000.0,Cell Phones & Accessories,4,China
284,"RORRY Portable Charger, 5000mAh Portable Charger Power Bank with Built-in Cables, Travel Keychain Battery Pack for Apple Watch Ultra 2/9/8/Ultra/7/6/SE/5, iPhone 16/15/14/13/12, White",ROR¦¦¦DIR¦¦¦,"The video showcases the product in use.The video guides you through product setup.The video compares multiple products.The video shows the product being unpacked. Previous page Next page 1 On-the-go 2 Small & Portable 3 All-in-One 4 Keychain Design Charger for Apple Family iPhone/Airpod/iPad 2024 - for iPhone 16/16 Plus/16 Pro/16 Pro Max2023 - for iPhone 15/15 Plus/15 Pro/15 Pro Max2022 - for iPhone 14/14 Plus/14 Pro/14 Pro Max/iPhone SE2021 - for iPhone 13 Pro Max/13 Pro/13/13 mini; 2020 - for iPhone 12 Pro Max/12 Pro/12/12 mini/ SE (2nd); 2019 - for iPhone 11 Pro/ 11 Pro Max/ 11; 2018 - for iPhone XS/ XS Max/ XR/ X; 2017 - for iPhone 8/ 8 Plusfor AirPods (1nd Gen), AirPods (2nd Gen), AirPods Pro, AirPods (3rd Gen), AirPods Pro (2nd Gen), AirPods (4rd Gen)     Compatible with Apple Watch 2023 - for Apple Watch Series 9 / Ultra 2;2022 - for Apple Watch Series 8 / Ultra / SE(2nd Gen);2021 - for Apple Watch Series 7;2020 - for Apple Watch Series 6/SE; 2019 - for Apple Watch Series 5; 2018 - for Apple Watch Series 4; 2017 - for Apple Watch Series 3;   Portable Keychain Design With its small and lightweight keychain design, you can easily carry this portable charger in your pocket or hang it on your backpack.   USB-C Input & Output USB C port can fully recharge the battery in 3 hours, and can also output current to the device you need to charge through this port.   Pass Through Charging Charge for iPhone and for Apple Watch while recharging the power bank, great for over-night charging.   Packing List Power Bank 5000mah * 1 USB-C to USB-C Charging Cable * 1 User manual * 1 More Choices for You Portable Charger 5000mAh Add to Cart Fast Charging 10000mAh Add to Cart Portable Charger 2500mAh Add to Cart Portable Charger 5000mAh Buying Options Portable Charger 10000mAh Add to Cart Portable Charger D5 Add to Cart USB-C Portable Charger Add to Cart Customer Reviews 4.4 out of 5 stars 1,988 4.4 out of 5 stars 223 4.7 out of 5 stars 77 — 4.3 out of 5 stars 147 4.1 out of 5 stars 93 4.3 out of 5 stars 89 Price $32.99$32.99 $41.98$41.98 $23.99$23.99 — $34.99$34.99 $19.99$19.99 $19.99$19.99 Main Feature Bulit-in Cables, 3-in-1 Bulit-in Cables, 3-in-1 Keychain Charger for iWatch Pocket Size, 2-in-1 Bulit-in Cable, 3-in-1 Bulit-in Plug, Pocket Size USB-C, for iPhone 15 Compatibility 5000mAh 10000mAh 2500mAh 5000mAh 10000mAh 5000mAh 5000mAh Output 5V/2A PD 20W 5W 5V/2A 5V/2A, Output Port 15/20/22.5W 5V/3A 5V/3A Recharging Time 2h40m 3h30m 1H30m 2h45m 2h27m 2h45m 2h45m Dimensions 3.54“ x 2.75” x 0.63” 4.33“ x 2.83” x 0.83” 2.95"" x 1.77"" x 0.47"" 3.54*2.56*0.66 inches 4.68*2.95*0.79 inches 3.1*1.63*0.96 inches 3.1*1.63*0.96 inches Weight 0.28 lbs 0.45 lbs 0.17lbs 0.25 lbs 0.44 lbs 0.23 lbs 0.23 lbs Built-in Cable ? ? ? ? ? ? ? LED Indicator ? ? ? ? ? ? ?",33.0,33.0,1988,256,4.4,3000.0,Cell Phones & Accessories,17,China
295,"Anker 45W USB C Charger Block, Foldable PPS Fast Charger for iPhone 16/15 and More Series, Supports Super Fast Charging 2.0 for Galaxy S24 Ultra",Ank¦¦¦ire¦¦¦,"Previous page Next page 1 MultiProtect 2 Charge Safely Previous page Next page 1 For Samsung 2 For Apple 3 For Android How can I get Super Fast Charging 2.0 for Samsung Galaxy S23+ / Galaxy S23 Ultra? Use a 5A (100W) E-Marker USB-C to USB-C cable with Anker 313 Charger (Ace, 45W). How long does it take for Anker 313 Charger (Ace, 45W) to fully charge a Galaxy S23 Ultra? The charger can fully charge a Galaxy S23 Ultra in about 1 hour when used with the correct cable. Can Anker 313 Charger (Ace, 45W) charge a Steam Deck at full speed? Yes. Why did the fast charging prompt on my Samsung mobile phone appear and then disappear immediately? After the release of Android 13, fast charging prompts like ""Super Fast Charging"" and ""Super Fast Charging 2.0"" will disappear after a few seconds. Go to Settings > Battery to see the charging mode. What are the specs of Anker 313 Charger (Ace, 45W)? Input: 100 - 240V Output: 5.0V=3.0A / 9.0V=3.0A / 15.0V-3.0A / 20.0V=2.25A (45W Max); PPS: 3.3V-11V=5A / 3.3V-16V=3A / 3.3V-21V=2.25A (45W Max) Comparison Anker 313 Charger Add to Cart Anker 25W Charger Add to Cart Anker 543 Charger Add to Cart 45W USB-C Charger(2 pack) Add to Cart 25W USB-C Charger(2 pack) Add to Cart Anker 315 Charger 67W Add to Cart Customer Reviews 4.8 out of 5 stars 5,837 4.8 out of 5 stars 106 4.7 out of 5 stars 2,454 4.7 out of 5 stars 712 4.7 out of 5 stars 1,184 4.8 out of 5 stars 608 Price $19.99$19.99 $12.99$12.99 $39.95$39.95 $29.99$29.99 $19.99$19.99 $24.99$24.99 Charging Ports 1 USB C 1 USB C 2 USB C + 2 USB A 1 USB C 1 USB C 2 USB C + 1 USB A Main Feature 45W 25W GaN 65W 45W( 2 pack + 2 cables) 25W( 2 pack + 2 cables) 67W Compatible Devices For Tablets and Samsung For Tablets and Samsung For Phones, Tablets, Notebooks For Tablets and Samsung For Tablets and Samsung For Laptops, Phones, Tablets Support Super Fast Charging2.0 v / / / / v Size/Inch 1.49 x 1.38 x 1.61 1.22 x 1.22 x 1.42 3.54 x 3.41 x 0.71 1.77 x 1.11 x 1.96 1.77 x 1.1 x 1.97 1.9 x 1.7 x 1.4 Weight/lb 0.15 0.15 0.36 0.68 0.44 0.23",24.0,20.0,5837,428,4.8,10000.0,Cell Phones & Accessories,69,China
299,"Macally Apple Watch Charger Stand for Series Ultra, 10, 9, 8, 7, 6, 5, 4, 3, 2, 1, SE (44mm, 42mm, 40mm, 38mm) - Sleek iWatch Apple Watch Stand Dock - The Perfect Apple Watch Charging Station - Black",Juk¦¦¦ar,"Previous page Next page 1 Compatability 2 Fits any case or bands Previous page Next page 1 Cable Management 2 For Magsafe Previous page Next page 1 Metal Base 2 Secure and Snug 3 Dimensions   Stands for Your Space. MWATCHSTANDB Add to Cart MWATCHSTAND31 Add to Cart ASTANDSG Add to Cart VCSTAND Add to Cart STANDWALLMOUNT Add to Cart CLIPMOUNT Add to Cart Customer Reviews 4.7 out of 5 stars 9,937 4.0 out of 5 stars 1,996 4.7 out of 5 stars 2,096 4.6 out of 5 stars 2,163 4.3 out of 5 stars 462 4.3 out of 5 stars 2,958 Price $12.99$12.99 $9.88$9.88 $44.99$44.99 $29.99$29.99 $14.99$14.99 $24.99$24.99 Description iWatch Stand 3 in 1 Apple Charging Stand Lifted Stand For Laptops Vertical Macbook Stand 2-in-1 Tablet Holder Adjustable Tablet Holder Main Feature Hides iWatch Charger Charge iPhone iWatch & Airpods Naturally Cools Laptop Connect Second Monitor Use as Stand or Mount on Wall Use as Stand Compatability iWatch 9, 8, 7, 6, 4, 3, 2, 1 iPhone, iWatch, & Airpods Laptop Between 10""-17"" Wide Laptop Between 0.63” & 1.19” devices between 4.8"" and 7.5"" Devices between 4’” to 8” Color Black Black and Silver Silver Black White and Silver Black Comes with charger? ? ? ? ? ? ?",20.0,13.0,9937,5477,4.7,500.0,Cell Phones & Accessories,97,China
302,"Phone Holder for Running Armband iPhone 15 14 13 12 11 Pro Max XS XR X 8 7 6 Plus SE Mini Galaxy Ultra Edge S24 S23 S22 S21 S20 Note 20 10 Pouch Bag,Arm Band Sleeve Fit Sport Gym Hiking-Black",MOV¦¦¦E,"MOVOYEE Phone Holder for Running GYM Sports Walking, Armband Cell Phone Holder for Women Men Kids Fit All the Smart Phones, iPhone, Samsung, more. High Recommendly this cell Phone arm holder mobile phone armband!   This Cell Holder Arm Band Arm Phone Holder for Women Men Kids Perfect for All Activites To Be Widely Used For: ? GYM Workouts(gym phone holder/phone workout armband) ? Extreme Exercise(iphone exercise armband) ? Running(running armband phone holder) ? Fitness ? Walking ? Jogging ? Hiking ? Cycling ? Yoga ? Fishing ? Camping ? Travelling ? Daily leisure Compatible with Most of Smartphones: ? Apple iPhones,iPhone 15 Pro Max/15 Plus/15 Pro/15/14 Pro Max/14 Plus/14 Pro/14/SE 2022/13 Pro Max/13 Pro/13/13 Mini/12 Pro Max/12 Pro/12/12 Mini/SE 2020/11 Pro Max/11 Pro/11/XS MAX/XR/XS/X/10/8 Plus/7 Plus/8/7/6S Plus/6 Plus/6S/6/SE/5S/5C/5/4(iphone purse crossbody for women men kids). ? Samsung Galaxy Smart Phones Ultra S FE Plus Edge Series S24+ S24 S23+ S23 S22+ S22 S21+ S21 S20+ S20 S10+ S10 S9+ S9 S8+ S8 Plus/S10e/S7 S6 Edge/S5/S4, Note 20 Ultra, Note 20 10 9 8 5 4. ? Google,LG,Oneplus,Nexus,ZTE,Huawei,Xiaomi,Android,iPod touch,Airpods,Mp3,more.       No Slip & Adjustable Strap Our sports phone holder won’t move from your upper arm when you’re running,workout or weight lifting. Our adjustable velcro straps securely fit any upper arm with a circumference of 8 to 16 inches. Headphone Hole Armbands for Phones with Headphone Cord Management Jack, easily access to answer the calling and listen to music while sports. Large Storage There are separated dual pockets, main pocket to hold smartphone & the other one for key, money, cash, id/credit cards, earphones, cable, charger, iPod, Mp3, passport, facial tissue, more essentials.   This item is the great ideal gift for Girls/Girl, Toddlers, Teens, Mum/Mom, Boys/Boy, Women/Womens, Men/Mens, Kids/Kid, Child/Children, Family Remembers, Friends on Birthday, Childrens Day, Mums Day, Dads Day, Christmas Day, New Year, Valatines Day, Festival Day. Mens arm band for men, arm bag for women, arm band kids, boys, girls, crossbody phone bags for women men kids. 3 in 1 armband crossbody bag with hook Large Armband Arm Bag Slim Armband Cell Phone Holder Slim Fanny Pack Running Belt Waterproof Fanny Pack Add to Cart Add to Cart Buying Options Add to Cart Add to Cart Add to Cart Customer Reviews 4.0 out of 5 stars 159 4.4 out of 5 stars 436 3.7 out of 5 stars 646 4.2 out of 5 stars 428 4.2 out of 5 stars 114 3.8 out of 5 stars 98 Price $8.23$8.23 $8.29$8.29 — $7.99$7.99 $7.99$7.99 $13.63$13.63 Fit Phone Size Up to 7.2 inches Up to 7.2 inches Up to 6.7 inches Up to 7.2 inches Up to 7.2 inches Up to 7.2 inches Option Colors Black,Pink,Blue Black,Purple,Pink,Blue Black,Pink,Blue Black,Pink,Blue Black,Blue Black Earphone Hole No ? ? ? ? No Adjustable Strap ? ? ? ? ? ? Breathable ? ? ? ? ? ?",10.8,8.99,3292,5366,4.4,500.0,Cell Phones & Accessories,10,China
304,"Wireless Charging Station,3 in 1 Wireless Charging Stand Made for Apple Watch Ultra 9 8 7 6 SE 5 4 3,Fast Wireless Charger Made for iPhone 15/Plus/Pro Max/14/13/12/11/X,for AirPods Pro(with Adapter)",Lan¦¦¦n S¦¦¦e,"The streamlined design keeps each device stacked up in a space-saving tower. Featuring wireless charging support for all your Apple devices to quickly power your iPhone(7.5W), Apple Watch (2.5W), and AirPods(2.5W) simultaneously, so they are charged and ready whenever you are. The video showcases the product in use.The video guides you through product setup.The video compares multiple products.The video shows the product being unpacked. Designed for Convenience   Previous page Next page 1 Perfect Viewing Angle 2 Vertical & Horizontal 3 Case Friendly 4 Sleep Friendly Streamline your Charging Setup   Make your life easier   Now, go to tidy up your nightstand instantly! Reduce the number of cables in your life, and make phone charging a breeze with a handy wireless charging station.",28.6,26.0,10668,412,4.4,5000.0,Cell Phones & Accessories,17,China
305,"ULANZI Magnetic iPhone Tripod Mount MA23, Magnet Phone Holder Adapter Tripod Attachment Compatible with MagSafe Only for iPhone 12 13 14 15 16 Plus Pro Max All Series",ULA¦¦¦ Of¦¦¦ial¦¦¦¦¦¦¦¦¦,"Flexible Adjustment of Z-axis You can freely adjust the pitch angle of backward 0-90° and capture different angles. Preferred choice for Ulanzi phone magnetic mount for magsafe.   360° Rotation Angle You can adjust the horizontal or vertical screen shooting according to your preference to satisfy your VLOG video shooting   Hot Shoe Plate This new MA23 phone Magsafe mount has its own hot shoe lock at the bottom, which can be directly fixed on the camera hot shoe mount, compatible with Sony Canon Nikon cameras DJI roin s/sc/rs Zhiyun crane gimbal   1/4"" Standard Screw Hole The universal design is suitable for most tripods, monopods, selfie sticks, ring lights, etc. It is a perfect match for the photography industry",24.0,24.0,501,9253,4.5,200.0,Cell Phones & Accessories,94,China
306,Plantronics - Voyager 5200 (Poly) - Bluetooth Over-the-Ear (Monaural) Headset - Compatible to connect to Cell Phones - Noise Canceling,Ama¦¦¦.co¦¦¦,"From noisy city streets to inside your car, you’ll be heard clearly with the Voyager 5200 earpiece headset. Sound professional in any environment with your Plantronics headset’s six layers of WindSmart technology and four omnidirectional microphones—the ideal solution for reducing distracting background noise such as wind, chatter, and traffic. With a Bluetooth 5.0 connection, you’ll be able to freely move up to 98 feet (30 meters) as well as connect a second smartphone or tablet with your headset’s multipoint technology. The ergonomic design ensures all-day comfort, from the first call of the day to the last. What’s more, this Bluetooth headset for cell phones is pocket-sized and features a moisture-resistant P2i coating so you can confidently take calls anywhere. Talk hands-free and simplify mobile communications with smart assistance features such as caller ID and talk-time alerts, voice controls like Answer or Ignore, and a dedicated button for activating Siri, Google Assistant, or Cortana. Plus, your headset works smoothly with iPhone, Android, and other leading smartphones. With the Voyager 5200, anywhere is a great place to talk.",100.0,90.0,25497,755,4.0,4000.0,Cell Phones & Accessories,2,China
307,"INIU Wireless Charger, 15W Fast Qi-Certified Wireless Charging Station with Sleep-Friendly Adaptive Light Compatible with iPhone 16 15 14 13 Pro XS 8 Plus Samsung Galaxy S23 S22 S21 Note 20 Google etc",Ama¦¦¦.co¦¦¦,"15W Max Wireless Charging Holder     Best Viewing Angle While Charging     Previous page Temp°Guard 2.0 Monitors Temp 3,200,000+ Times Daily Monitor temp and manage device's battery, dealing with wireless charging's limits and heat concerns. SmartProtect 2.0 Protects Your Devices Dynamic overcharge protection, auto-shut-off mode when 100% charged, safeguarding battery all night. Next page 1 Temp°Guard 2.0 2 SmartProtect 2.0 Through-Case Charging   No need to remove phone cases(=4mm). Our intelligent FOD system detects all the foreign objects (magnets, metal attachments, cards), indicated by a flashing LED light.   Experience the magic of breathing LED indicator that Auto-adjusts to your surroundings, providing the perfect brightness while reading, working, or sleeping.   15W Wireless Charger Comparison PD/QC=18W, Excluded Required Charger PD/QC=18W, Excluded =4mm Phone Case Thickness =4mm 3.3h iPhone 14 (0-100%) 3.3h 2.8h Samsung S23 (0-100%) 2.8h 3.2h iPhone 13 (0-100%) 3.2h 3.6h Pixel 6 (0-100%) 3.6h 3.3ft USB A-C Cable Cable Equiped 3.3ft USB A-C Cable PD/QC=18W, Excluded Required Charger PD/QC=18W, Excluded =4mm Phone Case Thickness =4mm 3.3h iPhone 14 (0-100%) 3.3h 2.8h Samsung S23 (0-100%) 2.8h 3.2h iPhone 13 (0-100%) 2.9h 3.6h Pixel 6 (0-100%) 3.5h 3.3ft USB A-C Cable Cable Equiped 3.3ft USB A-C Cable PD/QC=18W, Excluded Required Charger PD/QC=18W, Included =4mm Phone Case Thickness =4mm 3.3h iPhone 14 (0-100%) 3.5h 2.8h Samsung S23 (0-100%) 3.1h 3.2h iPhone 13 (0-100%) 3.3h 3.6h Pixel 6 (0-100%) 3.6h 3.3ft USB A-C Cable Cable Equiped 3.3ft USB C-C Cable Previous page 2 Pack Wireless Charger 15W Wireless Charger 3-in-1 Wireless Charger Next page Learn More Learn More Learn More",27.0,13.0,30212,32,4.3,10000.0,Cell Phones & Accessories,2,China
309,PHOOZY Thermal Phone Case for Cold Weather | Insulated Phone Pouch Extends Battery Life 3X | Snow-Proof & Water-Resistant | Snowboard & Skiing Accessories | As Seen on SHARK TANK (APOLLO SILVER-LARGE),PHO¦¦¦,"Product Comparison Table Apollo Add to Cart Apollo II +antimicrobial Add to Cart XP3 +antimicrobial Add to Cart Orion Capsule Add to Cart Customer Reviews 4.2 out of 5 stars 1,017 4.2 out of 5 stars 804 3.9 out of 5 stars 70 4.1 out of 5 stars 44 Price $32.99$32.99 $42.89$42.89 $42.89$42.89 $59.99$59.99 Thermal Barrier ? ? ? ? Spacetech Layer ? ? ? ? Impactor Drop Rating 8' 10' 12' 12' Antimicrobial Lining ? ? ? ? Internal Pocket ? ? ? ? EZ-Open Grip Tabs ? ? ? ? Attachment System ? ? ? ? Best for Most phones Most phones Most phones Larger phone / bulky case Previous page Next page 1 Which Size? 2 Height & Width 3 Thickness 4 Find Your Size",33.0,33.0,1017,16542,4.2,200.0,Cell Phones & Accessories,20,China
314,"JUESHITUO for iPhone 16 Pro Max Case with 2X Screen Protector [Built-in Lens Protector] [Stronger N56 Magnets] [Not-Yellowing] Compatible with Magsafe Women Girls Color Case (6.9"")-Desert Titanium",JUE¦¦¦ TU¦¦¦ire¦¦¦,"Ultra-full Camera Protection   1:1 Reproduction - Slim as Original   Beyond-Grade N56 Magnets     Premium Camera & Screen Protection   2024-Innovation Leads Fashion   Please recognize the JUESHITUO brand, the ONLY official genuine products. Counterfeit products do not provide our brand's lifetime warrenty service. Previous page Next page 1 Military Drop Protection 2 Camera Lens Protection",20.0,18.0,62,1612,4.4,2000.0,Cell Phones & Accessories,17,China
317,"Eicaus 72'' Phone Tripod, Tripod for iPhone & Selfie Stick Tripod with Phone Mount and Remote - Upgraded, Stable, and Portable Tripod for iPhone 15/14/13, Android, Cameras and Action Cameras",EES¦¦¦EAM¦¦¦,The video showcases the product in use.The video guides you through product setup.The video compares multiple products.The video shows the product being unpacked. Previous page Next page 1 Angle Adjustment 2 Detachable Remote Previous page Next page 1 Adjustable Height 2 Enhanced Stability Previous page Next page 1 Light&Mic Expansion 2 Phone Protection Previous page Next page 1 Group Photo 2 Scenic Photography 3 Video Recording 4 Vlog Filming,27.0,27.0,794,5572,4.6,400.0,Cell Phones & Accessories,59,China
