,title,seller_name,description,initial_price,final_price,reviews_count,root_bs_rank,rating,bought_past_month,root_bs_category,bs_rank,country_of_origin
702,"Ailun Glass Screen Protector for iPhone 16 Plus/iPhone 15 Plus/iPhone 15 Pro Max [6.7 Inch] Display 3 Pack Tempered Glass, Dynamic Island Compatible, Case Friendly[Not for iPhone 16 Pro Max 6.9 Inch]",Ail¦¦¦S,"Related Product 16 Plus/15 Plus/15 ProMax Add to Cart iPhone 15 Plus Add to Cart iPhone 15 Pro Max Add to Cart iPhone 15 Plus Add to Cart iPhone 15 Pro Max Add to Cart 16 Plus/15 Plus/15 ProMax Add to Cart iPhone 16/15/15 Pro Add to Cart Customer Reviews 4.4 out of 5 stars 8,926 4.5 out of 5 stars 79,593 4.5 out of 5 stars 79,593 4.4 out of 5 stars 57,222 4.4 out of 5 stars 57,222 4.4 out of 5 stars 8,926 4.4 out of 5 stars 9,784 Price $5.90$5.90 $5.86$5.86 $5.86$5.86 $8.90$8.90 $8.90$8.90 $6.89$6.89 $5.90$5.90 Brand Ailun Ailun Ailun Ailun Ailun Ailun Ailun Compatible Models iPhone 16 Plus/15 Plus/Pro Max iPhone 15 Plus iPhone 15 Pro Max iPhone 15 Plus iPhone 15 Pro Max iPhone 16 Plus/15 Plus/Pro Max iPhone 16/15/15 Pro Display Size 6.7 inch 6.7 inch 6.7 inch 6.7 inch 6.7 inch 6.7 inch 6.1 inch Quantity 3 Pack 3+3 Pack 3+3 Pack 3+3 Pack 3+3 Pack 3 Pack 3 Pack Color Clear Clear Clear Black Black Black Clear Feature Screen Protection Screen+Lens Protection Screen+Lens Protection Privacy Screen+Lens Protection Privacy Screen+Lens Protection Privacy Screen Protection Screen Protection       The video showcases the product in use.The video guides you through product setup.The video compares multiple products.The video shows the product being unpacked. 1. The flexibility of the glass screen protector is the same as the plastic material, is it tempered glass or plastic? This screen protector is a real tempered glass. The plastic flexibility is the exact reason why we call it tempered glass screen protector. Tempered glass is a type of safety glass that is stronger than ordinary glass. 2. It cannot be seen from the appearance that it is glass or plastic. As a customer, what can we do to identify it? There is an easy, quick, cost-effective way to test it yourself, and it's very accurate. Most plastics have a melting point between 160 and 210 degrees Celsius, and glass materials are at least over 1400 degrees Celsius, so is there a lighter around? 3. Does it come with a cleaning wipe to use prior to placing on the phone? Yes, the package includes: 6*Guide Stickers, 3*Wet Wipe & 3*Dry Wipe, 3*Dust Absorber 4. How can I remove bubbles? Use the kit in the package to clean the screen before placing the screen protector. If there are bubbles,try to gently press the bubbles with your finger or with a ruler,but the screen surface needs a thin cloth pad to avoid scratching the protector. 5. How can I remove a cracked glass screen protector? Lift the screen protector with the card from any corner of the screen protector, then hold the corner and remove slowly. (If you find CHIP or CRACK on the screen protector, for your safety, please wear gloves when removing the screen protector.)",8.98,5.9,8926,34,4.4,10000.0,Cell Phones & Accessories,14,China
718,"OUTXE Universal Phone Tether Tab Without Adhesive, 4 Pack Phone Lanyard Replacement Part for Phone Strap (4 PCS)",Out¦¦¦Sto¦¦¦,"OUTXE Phone Tether Tab PVC Phone Tether Tab Add to Cart TPU Phone Tether Tab Add to Cart Nylon Phone Tether Tab Add to Cart Metal Phone Tether Tab Add to Cart Customer Reviews 4.5 out of 5 stars 2,457 4.7 out of 5 stars 4 4.7 out of 5 stars 4 4.8 out of 5 stars 16 Price $5.99$5.99 $9.99$9.99 $4.99$4.99 $8.89$8.89 Adhesive ? ? ? ? Color Black Clear White Silver Material PVC TPU Nylon Steel Fit Phones Model All Phone All Phone All Phone All Phone Support Corded Charging ? ? ? ? Support Wireless Charging ? ? ? ?",6.99,5.99,2457,8057,4.5,200.0,Cell Phones & Accessories,65,China
720,"Basesailor USB to USB C Adapter for iPhone 16 Charger 2Pack,USBC Female to A Male OTG Type C Converter for Apple Watch Ultra iWatch 7 8 9 10,iPhone 15 14 13 Plus Pro Max,AirPods,iPad,Car,Samsung S24",Bas¦¦¦ilo¦¦¦ire¦¦¦,"Previous page Next page     Does this adapter support CarPlay functionality? This adapter may support CarPlay in some car models, but it is not universally compatible due to varying technical requirements and compatibility factors across different vehicles and devices. Does this adapter transfer HDMI or VGA video signal? No, this adapter is USB 2.0 version and cannot transmit HDMI or VGA signals. Is this adapter compatible with all Dell docking stations? No, this adapter is not compatible with some Dell docking stations. Please check the compatibility before purchasing. What is the maximum data transfer speed and charging output power? The maximum data transfer speed is 480Mbps and the charging output power is 2A. You Will Also Like USB to USBC Adapter 2Pack Add to Cart USB to USBC Adapter 3Pack Add to Cart USBC to USB Adapter 3Pack Add to Cart USB to USBC Adapter 4Pack Add to Cart USB C Adapter 3Pack Add to Cart USBC to USB Adapter 3Pack Add to Cart Customer Reviews 4.6 out of 5 stars 101,053 4.6 out of 5 stars 93,527 4.7 out of 5 stars 8,487 4.6 out of 5 stars 3,117 4.6 out of 5 stars 1,158 4.6 out of 5 stars 6,110 Price $8.99$8.99 $9.49$9.49 $9.99$9.99 $9.99$9.99 $8.99$8.99 $8.99$8.99 Color Gray Gray Gray Gray Gray Black Quantity 2 3 3 4 3 3 Gram 10.5 13.4 18 22.8 12.5 22 Connector 1 USB A (Male) USB A (Male) USB C (Male) USB A/C (Male) USB C (Male) USB C (Male) Connector 2 USB C(Female) USB C(Female) USB A(Female) USB A/C(Female) USB C(Female) USB A(Female)",16.0,8.99,101053,41,4.6,10000.0,Cell Phones & Accessories,1,China
725,"SAMSUNG Galaxy S24 Ultra S Pen Replacement, 0.7mm Fine Tip for Precision, Air Command Touch-Free Control, US Version, EJ-PS928BBEGUS, Dark Gray",Ama¦¦¦.co¦¦¦,"Get ready to elevate your Galaxy S24 Ultra¹ experience to a whole new level. Capture epic moments by controlling your camera shutter with a click of the S Pen and effortlessly navigate features using Air Command. Plus, say goodbye to charging hassles as your device conveniently powers up your S Pen, ensuring you’re always ready for whatever the day throws at you. ¹S Pen only compatible with Galaxy S24 Ultra. Galaxy S24 Ultra sold separately. ²Actions and gestures may vary according to the app.",50.0,35.3,89,2283,4.8,500.0,Cell Phones & Accessories,54,Vietnam
732,"LISEN 90W USB C Cigarette Lighter Adapter Fast Charger, USB C Car Charger for iPhone 16[All Metal & Mini] Dual PD45W&QC 3.0 Super Fast USB C Cigarette Lighter Adapter for iPhone 16 Pro Galaxy S24 iPad",B K¦¦¦,"Model Number 2E790 Input Voltage 12/24V = 5A OUTPUT 5V=3A / 9V=3A / 12V=3A / 20V=2.25A (45W Max Per Port) TOTAL OUTPUT 90W Max Double Duty Our most advanced charging technology ever charges virtually any device at its fastest possible speed. PowerIQ 3.0 provides full-speed charging with support for Qualcomm Quick Charge and USB-C Power Delivery for phones, tablets, and more Mini Size The mini size (2.1"" (L) x 0.9"" (W)) body fits most car Cigarette Lighter Adapter and barely protrudes past the edge of the outlet, providing a trim, less cluttered look MultiProtect Advanced temperature control, overload protection, and more combine for total peace-of-mind while charging your devices Easy Access This charger takes up only as much space as it needs and not a millimeter more, allowing you to access other dashboard functions with ease USB-C Port Compatible PD3.1/PD3.0/PD2.0/QC3.0/QC2.0/PPS/AFC/FCP/DCP1.5A/BC1.2/iPhone 2.4A, etc Can this PD car charger fast charge the newest iPhone 16 pro max? This PD car charger supports the iPhone 16 Pro Max's 45W fast charging, providing maximum speed. It's also backward compatible with other Apple devices, ensuring efficient charging for previous iPhone models at their highest speeds Will this USB C car charger FAST CHARGE Samsung Galaxy S24 or other phones? Yes. This USB car charger can fast charge all prevailing phones, not only iPhone, but also Android phones and other devices, such as Samsung Galaxy S24/S23/S22/S21/S20/S10/S9, NOTE 20/10/9/8/+, Google Pixel 6/4/3/3A/2/1/XL, iPad Air/Pro/Mini, etc Is this a USB-A port car charger? No, this is a USB-C charger. Does this car charger come with a cable? What cable do I need to pair with this car charger? This car charger is sold without cable. Purchase separately or use an existing USB-C cable. For iPhone, use a USB-C to Lightning cable; for USB-C devices (e.g., Samsung), use a USB-C to USB-C cable",25.0,9.98,757,1172,4.5,3000.0,Cell Phones & Accessories,31,China
733,"EYZUTAK Case for iPhone 12, Colorful Retro Oil Painting Printed Flower Laser Beam Glossy Pattern Cute Curly Waves Border Exquisite Phone Cover Stylish Durable TPU Protective Case for Girls Women-Green",EYZ¦¦¦K,"Previous page Next page Notice Please : not 3D flower, without 3D touch. Minor color difference is normal due to the holographic craft.     Previous page Next page Trendy Dreamy Pretty High-end Aesthetic Style. The outer layer of the phone case will reflect blue light, giving it a special gorgeous shine. Ideal Choice as a Gift - This case is perfect as a birthday, holiday, anniversary, Christmas and Valentine's Day gift for your family, friends and loved ones. Product Comparison Table Pretty Print Flower Case Add to Cart Cute Moon Flower Case Add to Cart Cute Moon Flower Case Add to Cart Cute Moon Flower Case Add to Cart Heart Magnetic Phone Case Add to Cart 3D Bling Stars Heart Case Add to Cart Cute Cartoon Flowers Case Add to Cart Customer Reviews 4.4 out of 5 stars 6,878 4.4 out of 5 stars 579 4.4 out of 5 stars 579 4.4 out of 5 stars 579 4.5 out of 5 stars 62 3.2 out of 5 stars 15 4.4 out of 5 stars 59 Price $9.99$9.99 $9.99$9.99 $9.99$9.99 $9.99$9.99 $9.99$9.99 $9.99$9.99 $8.99$8.99 Adapt Phone iPhone 14 Pro Max iPhone 14 Pro Max iPhone 13 iPhone 11 iPhone 14 Pro Max iPhone 14 Pro Max iPhone 15 Pro Max Size 6.7 inches 6.7 inches 6.1 inches 6.1 inches 6.7 inches 6.7 inches 6.7 inches 3D Tactile NO NO NO NO NO 3D NO Magnetic NO NO NO NO Magnetic NO NO Support Wireless Charging ? ? ? ? ? ? ? Drop Protection ? ? ? ? ? ? ?",9.99,9.99,6878,119,4.4,500.0,Cell Phones & Accessories,15,China
734,"ESR for iPhone 16 Pro Max Case, Compatible with MagSafe, Military-Grade Protective Case, Built-in Stash Stand iPhone Case,Scratch-Resistant Back Cover, Classic Series, Clear",Min¦¦¦tec¦¦¦S,"The video showcases the product in use.The video guides you through product setup.The video compares multiple products.The video shows the product being unpacked.     Previous page Next page 1 45 Min Faster 2 Thinner Back   Previous page Next page 1 Stronger Magnetic Lock 2 Stay Original Ultimate Protection, Unlimited MagSafe Classic Add to Cart Tempered-Glass Add to Cart Armorite Add to Cart Boost Add to Cart Classic Pro Add to Cart Car Charger with MagSafe Add to Cart Magnetic Charger Add to Cart Customer Reviews 4.5 out of 5 stars 33,700 4.3 out of 5 stars 90,273 4.3 out of 5 stars 20,482 4.5 out of 5 stars 31,389 4.6 out of 5 stars 97,798 4.4 out of 5 stars 6,432 4.6 out of 5 stars 1,069 Price $19.99$19.99 $9.99$9.99 $16.99$16.99 $19.99$19.99 $16.99$16.99 $34.99$34.99 $64.99$64.99 Product Type Hybrid Case + Stash Stand Screen Protector Screen Protector Kickstand Case Hybrid Case Set Car Charger with MagSafe Magnetic Charger Compatibility iPhone 16 series iPhone 16 series iPhone 16 series iPhone 16 series iPhone 16 series iPhone 12 series or later iPhone 12 series or later Wireless Charging MagSafe N/A N/A MagSafe MagSafe MagSafe MagSafe Magnetic Strength 1,500 g N/A N/A 1,500 g 1,500 g 1,600 g 1,000 g Main Feature Strong MagSafe lock Flawless Fit Tray UltraFit Tray 3-mode kickstand Strong MagSafe lock Qi2 15W certified charger Qi2 15W certified charger Other Feature Air Guard corners + lens stand 33-lb impact resistance 110-lb impact resistance Long-lasting clarity All-in-one protection Power in a snap Made for Apple Watch Material Acrylic, TPU, zinc alloy Tempered glass Ultra-tempered glass Acrylic, TPU, aluminum alloy Acrylic, TPU, PC ABS,PCBA,magnet,glass,silicone ABS, PC, PCBA, magnet, leather",27.0,20.0,33700,56,4.5,10000.0,Cell Phones & Accessories,5,
738,"Mini Tripod, Anozer Small Tripod with Universal Phone Holder & Cold Shoe,Lightweight Phone Tripod Stand Compatible with iPhone 15 Pro Max/15 Pro/14 Pro Max/14 Pro,Travel Tripod for Camera/GoPro/Webcam",CHU¦¦¦AN,"About this item ???Lightweight & Pocket Size Design???: With the max length of 6.30 inch(160mm), this mini tripod is super convenient to carry and fold up to store easily, you can just slip it into the pocket. Only weights 82g, it reduces weight of your backpack with taking up minimal space for travel photography. ???Adjustable Phone Holder with Cold Shoe???: The phone clip can be pulled out to 2.20-3.54 inch(56-90mm) , perfectly works with cell phones up to 6.7 inch. Features an adjustable joint, our mini tripod for camera can be tilted backward or forward within 180°and rotated within 360°, allows you simply take horizontal or vertical or any angles to capture the perfect shot. There is a cold shoe on the phone clip to attach LED lights, microphone or video monitors and other small accessories. ???3 in 1 Tripod???:This Anozer tabletop tripod can be used double as a phone stand or selfie stick. Open up to hold your phone or device stably for the tabletop use to watch videos, Zoom meeting, Live Streaming, video conference, record movies, lessons, or time lapse etc.. Its compact size (6.3inch) also makes a good operational handle when closed up for you to vlog, take selfie pictures, record video and so on. ???Sturdy Anti-Skid Legs???:The legs can be opened up wide and low that provides high stability on any surface without wobbles. With the anti-skid rubber pad on the end, this webcam tripod prevents it from slipping in different angles to conform to variable terrain. ???1/4"" Screw & Wide Compatibility???:This versatile small tripod for camera with the standard 1/4 screw allows a variety of devices to be mounted, like digital camera, action camera Gopro, webcam, mini projector, surround sound speakers, small LED light, pocket gimbal etc.. The phone holder fits cell phone within 6.7 inch, compatible with iPhone 15 Pro Max/15 Pro/15/15 Plus/14/14 Plus/14 Pro/14 Pro Max/13/13 Mini/13 Pro/13 Pro Max/12 Pro Max/12 Pro, Samsung Galaxy S22 Ultra/Note, Google etc.. › See more product details",11.0,9.99,1894,7050,4.5,500.0,Cell Phones & Accessories,68,China
741,DDUAN Upgrade Watch Charger 5.0 ft /1.5 m for iWatch Portable Wireless Charging Cable Compatible with Apple Watch Series 9/8/7/6/SE/SE2/5/4/3/2/1,cha¦¦¦r--¦¦¦p,"By placing the charger close to the back of the watch, the charging module will automatically adsorb the connection. For best charging results, the watch case should be no more than 5 mm when charging the watch, and it is best to remove the case for charging. Note: This is a USB-A port charging cable and cannot be adapted to Typc-C/USB-C ports. Watch Charger 5 ft /1.5 m 3 in 1 Foldable Wireless Charging Station Wireless Charging Station Wireless Charging Station Compatible for iPhone 5000mAh Portable Watch Charger for iPhone 15 Add to Cart Add to Cart Add to Cart Add to Cart Add to Cart Customer Reviews 4.5 out of 5 stars 1,441 4.0 out of 5 stars 409 4.1 out of 5 stars 610 4.0 out of 5 stars 409 4.8 out of 5 stars 59 Price $5.99$5.99 $39.99$39.99 $16.99$16.99 $39.99$39.99 $16.99$16.99 For Watches Compatible with All Watches Series SE2/SE/9/8/7/6/5/4/3/2/1 (All 38-45 mm Version) iWatch SE2/SE/9/8/7/6/5/4/3/2 iWatch SE2/SE/9/8/7/6/5/4/3/2 iWatch SE2/SE/9/8/7/6/5/4/3/2 iWatch SE2/SE/9/8/7/6/5/4/3/2 Adapter Not Included With Type C Cable and PD 20W Charging Adapter With Type C Cable and 18W Charging Adapter With Type C Cable and 18W Charging Adapter With Type C Cable For Phones and Charging Case iPhone 16/15/14/13/12/11/Pro/Max/XR/XS/XS Max/X/8 and AriPods 1/2/Pro iPhone 15/14/13/12/11/Pro/Max/XR/XS/XS Max/X/8 and AriPods 1/2/Pro iPhone 16/15/14/13/12/11/Pro/Max/XR/XS/XS Max/X/8 and AriPods 1/2/Pro iPhone 15/Samsung Phone For Qi Enabled Devices SAMSUNG/LG/SONY/GOOGLE/HUAWEI SAMSUNG/LG/SONY/GOOGLE/HUAWEI SAMSUNG/LG/SONY/GOOGLE/HUAWEI Power Bank 5000mAh 5000mAh 5000mAh",8.99,5.99,1441,1078,4.5,2000.0,Cell Phones & Accessories,20,
750,"Anker 321 MagGo Battery (PowerCore Magnetic 5K), 5,000mAh Magnetic Wireless Portable Charger, Compatible with iPhone 15/15 Plus/15 Pro/15 Pro Max, iPhone 14/13/12 Series(Black)",Ank¦¦¦ire¦¦¦,"Model Number: A1616 Anker 321 MagGo Battery (PowerCore 5K) The Snap and Go Magnetic Power Bank Huge Capacity, Slim Design With a huge 5,000mAh capacity, Anker 321 MagGo Battery is a powerful portable charger that is still slim and lightweight—ideal for charging on the go. Long-Lasting and Reliable Boasts a battery capacity that remains at 90% even after 20 months of use, surpassing the industry standard of 60% battery capacity. Colorful and Snappy Features a colorful design for iPhones that support magnetic wireless charging, including iPhone 12, 13, 14, 15 series, and later. Phone cases thicker than 2.5 mm or those that are non-magnetic may reduce charging efficiency and are not recommended. Power Through MagSafe Cases Compatible with MagSafe cases, allowing you to charge your iPhone without removing the case. Please note that it is not compatible with non-MagSafe phone cases. Compatibility iPhone 15, iPhone 15 Pro, iPhone 15 Plus, iPhone 15 Pro Max, iPhone 14, iPhone 14 Pro, iPhone 14 Plus, iPhone 14 Pro Max, iPhone 13, iPhone 13 Pro, iPhone 13 Pro Max, iPhone 13 mini, iPhone 12, iPhone 12 Pro, iPhone 12 Pro Max, and iPhone 12 mini. Notes: The magnetic charge only provides up to 7.5W maximum power.Use only with magnetic phone cases. Not compatible with non-magnetic phone cases, such as Otterbox defender cases.5,000mAh is the total nominal rated capacity of internal battery cells.5,000mAh cell capacity provides 0.8 iPhone 14 charges, 0.85 iPhone 14 Pro charges, 0.61 iPhone 14 Pro Max charges, and 0.6 iPhone 14 Plus charges.It's normal for the power bank to reach temperatures between 88-118°F when the ambient temperature is 77°F. This device complies with IEC 62368 certification standards, ensuring its safe operation. Anker 321 Magnetic Battery Anker MagGo Battery 10K Anker 622 Magnetic Battery (Upgraded Version) Anker 621 Magnetic Battery Anker 633 Magnetic Magnetic Battery Anker Zolo Magnetic Power Bank Add to Cart Add to Cart Add to Cart Add to Cart Add to Cart Add to Cart Customer Reviews 4.3 out of 5 stars 5,913 4.4 out of 5 stars 2,805 4.3 out of 5 stars 9,297 4.2 out of 5 stars 11,657 4.5 out of 5 stars 7,440 4.7 out of 5 stars 49 Price $19.99$19.99 $89.99$89.99 $44.99$44.99 $39.99$39.99 $54.99$54.99 $39.99$39.99 Series Basic Premium Premium Basic High Cell Capacity Basic Cell Capacity 5,000mAh 10,000mAh 5,000mAh 5,000mAh 10,000mAh 10,000mAh Size 3.70 x 2.50 x 0.59 in 4.22 x 2.71 x 0.78 in 4.13 x 2.62 x 0.50 in 4.13 x 2.62 x 0.45 in 4.21 x 2.62 x 0.71 in 4.07 x 2.72 x 0.81in Weight 129g/0.28lb 250g/8.8oz 142g/5oz 129g/0.28lb 218g/7.7oz 223.1g/7.87oz Recharging Time ~ 4 Hours (10W) ~ 2.75 Hours (20W) ~2 Hours (12W) ~2 Hours (12W) ~ 2.75 Hours (20W) ~ 2.5 Hours (20W) Compatibility iPhone 15/14/13/12 Series iPhone 15/14/13/12 Series iPhone 15/14/13/12 Series iPhone 15/14/13/12 Series iPhone 15/14/13/12 Series iPhone 15/14/13/12 Series",26.0,20.0,5913,258,4.3,3000.0,Cell Phones & Accessories,18,
752,"hohem iSteady X3 SE Gimbal Stabilizer for iPhone, Phone Stabilizer with Detachable Remote Control, Portable Foldable 3-Axis Phone Gimbal for Android & iPhone 16 15 Pro Max, Ideal for Travel Vlogging",hoh¦¦¦Dir¦¦¦,hohem iSteady X3 SE Gimbal Stabilizer - Filming on the Go The video showcases the product in use.The video guides you through product setup.The video compares multiple products.The video shows the product being unpacked. Previous page Next page 1 iSteady 8.0 Stabilization 2 Smart Tracking 3 Gesture Control Previous page Next page 1 Remote Control 2 Easy to Use 3 11-Hour Long Battery Life Previous page Next page 1 Inception Mode 2 Compact & Foldable 3 Timelapse Mode 4 Unlock your Creativity hohem iSteady X3 SE Compatibility List,70.0,65.0,42,2486,4.4,1000.0,Cell Phones & Accessories,6,China
757,"Belkin MagSafe 3-in-1 Wireless Charging Pad - Fast Wireless Charging for Apple Watch, iPhone 15, iPhone 14, iPhone 13, & iPhone 12 Series, & AirPods - Charging Station for Multiple Devices - White",Ama¦¦¦.co¦¦¦,"The Belkin MagSafe 3-in-1 Wireless Charging Pad is the perfect way to keep your devices charged and ready to go. This iPhone charger has three charging modules that can wirelessly charge your Apple iPhone, Apple Watch, and AirPods all at the same time.MagSafe technology is compatible with Apple iPhone 15, iPhone 14, iPhone 13, and iPhone 12 standard, Mini, Plus, Pro and Pro Max models. This wireless charging station ensures a secure and stable connection for your MagSafe accessories, so you don't have to worry about your devices slipping off the pad. With wireless fast charging you can refuel your iPhone from 0% to 80% in 45 minutes, so you can get back to using your devices in no time.The Belkin MagSafe 3-in-1 Wireless Charging Pad supports multiple device orientations, just place your iPhone on the charging pad for a secure, aligned connection. The wireless charging puck and pad are optimized for your Apple Watch, AirPods and AirPods Pro. With its slim design and folding plug prongs, it’s easy to slip into your bag for travel. And if you have multiple devices that use wireless charging, this is the perfect option for keeping them all charged while on the go.",150.0,127.0,1142,3042,4.3,500.0,Cell Phones & Accessories,91,Vietnam
759,"TOCOL 4 Pack Screen Protector for Apple Watch Ultra 1/Ultra 2 (2024) 49mm, [10X Military-Grade Shockproof], Tempered Glass Screen Protector for iWatch Ultra 49mm, Anti-Scratch, High Definition, Clear",Toc¦¦¦Tec¦¦¦,"About this item ?Compatibility Models?Only fit for Apple Watch Ultra 49 mm. Please check out the model before purchasing ? High-Quality Screen Protector?Premium imported material for Apple Watch Ultra 49 mm screen protector is at the top of the industry. Brings your Watch with smooth touch and anti-fingerprints. Military-Grade hardness tempered glass easily protects your screen from accidental drops, scratches, and crashes ?HD Experience?TOCOL 99.99% clarity tempered glass material restores the original beauty experience of the Watch Ultra screen protector. As amazing as ever ?Sensitive Touch? Cutting-edge technology materials and craftsmanship achieve the touch of a naked screen for apple watch ultra 49mm. the smooth experience starts now. Just touch and go ?Round-the-Clock Customer Service?: If you encounter any issues during or after the application, simply send us an email, our professional team will be more than happy to assist you › See more product details",9.99,9.99,10506,2548,4.3,500.0,Cell Phones & Accessories,40,China
761,for Magsafe Car Mount?20 Strong Magnets? Magnetic Phone Holder for Car Phone Holder Mount Truck Dash?360°? Cell Phone Holders for Your Car Accessories for women men iPhone 16 Pro Max 15 14 13 12 Plus,Kai¦¦¦le ¦¦¦ect¦¦¦,"Why choose this 2-in-1 magsafe car mount ? Flexible vent mounts or super-sticky adhesive mounts mean you can find the most stable, suitable and convenient mount for any car model.The most cost-effective and convenient option.Each installation model is the best design on the market!   The super strong magnet can suck the cell phone in 1 second. Thus ensuring your driving safety!   Two different bases can meet the needs of multiple scenarios   1.Adhesive Holder mounting mode: Solve the non-stick problem real dashboard car phone mounting pattern. Installation of beautiful, variable viewing angle, stylish and does not take up space in the car, easy to find everyone's favorite installation perspective   2.Car Vent Holder Mode: Easy to install and remove!Steel hook material, permanent use, not like plastic hooks that have breaking problems and need to be replaced often.1 steel hook is more durable than 15 plastic hooks!   What You will Get",20.0,13.0,5850,2134,4.5,1000.0,Cell Phones & Accessories,92,China
