,title,seller_name,description,initial_price,final_price,reviews_count,root_bs_rank,rating,bought_past_month,root_bs_category,bs_rank,country_of_origin
6,"AdTech 0453 2-Temp Dual Temperature Hot Glue Gun Full Size, Light Gray",Ama¦¦¦.co¦¦¦,"Product Description Hot Melt 2 Temp Glue Gun. Needle nozzle for precision gluing. Use any Full size glue stick. High temp for wood metal and glass. Low temp for foam lace and fabric. 40 watts. CAUTION: Melted glue will burn skin. Keep away from children. PROTECT DELICATE MATERIALS - Use the low-temp option to preserve fabrics, papers, and styrofoam LAY LONGER LINES - Switch to the high-temp option for larger projects, and keep that glue coming steady! HAVE CONFIDENCE YOUR BOND WILL LAST - Pair any of our glue guns with AdTech hot melt glue sticks for clear lines and a long-lasting bond JUST GRAB AND GO - Prop up your glue gun (and limit pesky glue drips!) with the included stand, and then just grab and go! SPECS: Pair with full-size (0.44” diameter) AdTech glue sticks, such as AdTech HiTemp or MultiTemp sticks 40-watt gun with energy-conscious design (reduces energy demand once it reaches temperature!) 5-foot cord Best for detail work, conference/group crafting and DIY projects From the Manufacturer Hot Melt 2 Temp Glue Gun. Needle nozzle for precision gluing. Use any Full size glue stick. High temp for wood metal and glass. Low temp for foam lace and fabric.",18.0,13.4,6429,4264,4.5,400.0,"Arts, Crafts & Sewing",21,Taiwan
30,"Mr. Pen Hot Glue Gun Kit - Glue Gun with 10 Glue Sticks, Mini Craft Glue Gun Set",Mr.¦¦¦n,"Mr. Pen Hot Glue Gun & Glue Sticks   Glue Gun   Hot Glue Gun Sticks   Glitter Hot Glue Sticks Quantity 1 + 10 Quantity 60 Quantity 48 Quality High-Quality Materials Quality Food-Grade EVA Material Quality Food-Grade EVA Material Size Different Sizes Size 4"" Size 4""",9.85,6.99,4609,1424,4.5,2000.0,"Arts, Crafts & Sewing",12,China
97,"ARTEZA Detail Paint Brushes, Set of 15, Fine Detail Brush Set for Miniature Models and Canvases",Ama¦¦¦.co¦¦¦,Previous page Paint Discover all the paints you’ll need to create limitlessly! Paper Preserve the vibrancy of your work with our acid-free paper Markers Capture and color your creative ideas with Arteza markers Crafting & Hobby Craft your way with our wide selection of craft supplies Office & School Keep things organized with our dependable supplies Next page 1 Paint 2 Paper 3 Markers 4 Crafting & Hobby 5 Office & School   The video showcases the product in use.The video guides you through product setup.The video compares multiple products.The video shows the product being unpacked.,27.0,14.7,3639,8813,4.7,100.0,"Arts, Crafts & Sewing",10,China
98,"X-ACTO X3730Q X3000 Rubber-Barrel Hobby Knife, Three #11 Blades, Black",Ama¦¦¦.co¦¦¦,"The X-ACTO X3000 Knife is perfect for professional artists, designers and students who need to store their X-ACTO blades for easy access. The back of the knife unscrews to store up to 5 extra # 11 blades (3 blades and a safety cap are included with this package). A textured no-slip grip improves comfort during usage and the anti-roll handle helps to prevent knife from falling off desk or table. It is made for delicate, precision cutting, trimming and stripping, and easily cuts paper, plastic, balsa, thin metal, cloth, film and acetate.",12.1,9.99,659,9347,4.4,600.0,"Arts, Crafts & Sewing",34,China
161,"Bougimal 32 Pieces Paint Brush Set, Artist Series, Nylon Bristles with Round, Filbert, Flat, Fan, Angle, Detail Brush, Suitable for Artists and Beginners for Acrylic Painting, Oil, Watercolor, Gouache",Bou¦¦¦alU¦¦¦,"Welcome to Bougimal - Start Your Art Journey with Bougimal Paint Brushes Set!   Why should you choose Bougimal acrylic paint brushes? The video showcases the product in use.The video guides you through product setup.The video compares multiple products.The video shows the product being unpacked. Exquisite Details Display - Your Ideal Choice!   High-Quality Nylon Crafted using premium nylon bristles, our brushes offer superior performance. Ours strike a perfect balance between flexibility and resilience.   No Shedding Our brushes prevent shedding and the bristles are securely bonded to the ferrule for a hassle-free and smooth painting experience.   Exceptional Adhesion Our brushes are known for their excellent paint adhesion. Whether you're using acrylics, oils, or watercolors, the bristles evenly distribute paint.   Comfortable Wooden handle The wooden handle is designed to conform to the curves of the hand, non-toxic&waterproof, making drawing less tiring even after long periods of time.     How to Do with the New Brushes? Before using, separate the bristles gently with fingers, soak them in warm water (around 30°C) for 3 minutes During this time, stroke the bristles in their natural direction to avoid shedding.After soaking, blot the brush with a tissue to remove excess water and let it air dry.   How Can You Extend the Lifespan of Your Brushes? Clean Brushes Promptly and Thorough: Clean brushes right after painting & wash brushes with warm water and mild soap to remove all paint residues.Proper Drying: Let brushes dry fully and store them with bristle tips facing up.Avoid Soaking: Don't leave brushes immersed in water for long. Suitable for Various types of Paint & Festivals, Items DIY & Coloring Models Previous page Next page More Bougimal Paint Brush Set Available 32 Pieces Paint Brush Set Add to Cart 33 Pieces Paint Brush Set Add to Cart 32 Pieces Paint Brush Set Add to Cart 32 Pieces Paint Brush Set Add to Cart Acrylic Paint Markers Add to Cart 32 Pieces Paint Brush Set Add to Cart Customer Reviews 4.7 out of 5 stars 936 4.9 out of 5 stars 18 4.7 out of 5 stars 936 4.7 out of 5 stars 936 4.5 out of 5 stars 38 4.7 out of 5 stars 936 Price $23.99$23.99 $29.99$29.99 $23.99$23.99 $23.99$23.99 $23.99$23.99 $23.99$23.99 Brush material Nylon Nylon Imported from Korea Nylon Nylon Premium Fiber Nylon Handle material Birch Wooden Birch Wooden Birch Wooden Birch Wooden Plastic Birch Wooden Metal ring material Aluminum Chrome-Plated Aluminum Aluminum Aluminum — Aluminum Complete brush size 7.08inch-7.67inch 7.01inch-9.94inch 7.08inch-7.67inch 7.08inch-7.67inch 6.7inch 7.08inch-7.67inch color Wooden Color Wooden Color Reddish Brown Orange 48 Colors Pearl White Number of sets 32 33 32 32 24 Sets 32 Is it solid ? ? ? ? ? ? Is there a pencil & sharpener ? ? ? ? ? ? Is there an eraser ? ? ? ? ? ? Is there a cloth bag ? ? ? ? ? ?",28.0,24.0,936,2819,4.7,1000.0,"Arts, Crafts & Sewing",44,China
171,"Small Paint Brushes for Crafts, Paint Brushes Set for Acrylic Painting 30PCS Bulk Paint Brushes, Mini Paint Brushes for Kids Adults Oil Watercolor Rock Painting Body Face Nail Art",hai¦¦¦wen¦¦¦,"High-Quality Materials Smooth acrylic handleSolid metal connectorsSoft and stretchy nylon bristles Easy to Maintain Lightweight, durable, easy to hold and clean.   Professional Paint Brush Set Suitable for everyone who have fun in painting!         Wonderful Gift A wonderful gift for family, students, teens, children, and friends who have fun in painting. Various Occasions Drawing and DIY Supplies grate for School, Classroom, Travel, Home, Office and Outdoor. Multifunctional Prefect for watercolor, oil, gouache, acrylic painting, enamel, cel vinyl, body/nail/face art painting, miniature, model, craft art painting, etc.",4.99,4.99,142,2921,4.6,300.0,"Arts, Crafts & Sewing",47,China
227,"Wooster 912-0031030020 Paintbrush, 2-Inch, White",Ama¦¦¦.co¦¦¦,"Thick, open-cell polyurethane foam holds more paint for better coverage. Smoothest “no brush marks” finish. White plastic handle has a built-in stiffener blade for consistent flex and neat, precise results. Use with all paints, varnishes, and stains. High-quality brushes, excellent for antiquing, decoupage, crafts, and smooth clear coats to protect the finishes. The Wooster Brush Company has been manufacturing innovative, high-performance painting tools right out of Wooster, Ohio USA since 1851. Our trade names include Ultra/Pro, Advantage, Yachtsman, Shortcut paintbrushes; Super/Fab, Super Doo-Z roller covers; Sherlock frames and extension poles; Jumbo-Koter minirollers; and Prep Crew surface prep tools. You can feel confident knowing Wooster is the name behind your painting tools.",2.75,1.8,1807,11056,4.6,300.0,"Arts, Crafts & Sewing",14,USA
228,Photomyne A4 Slide Viewer | Light Pad Backlight | Negative Viewer | Film Negatives & Old Slides Scanning Light Box | Hands-Free Ultra-Thin Ultimate Brightness (Includes USB Adapter) - Black,Pho¦¦¦yne¦¦¦D,"Memories live here Digitizing your memories and safeguarding your family history is easy with Photomyne’s apps. Every captured moment. Every family member. All from the comfort of your smartphone.   The Photomyne Scanning Suite Every photographed moment from your past deserves to look its best for the future. Photomyne’s scanning suite provides a simple solution for bringing generations of photos, slides, and film negatives into our digital world. The hard work is done for you as the apps automatically crop and enhance your newly digitized photos. Just start scanning.   Accessories Anyone can perfect their scanning project, especially with the help of Photomyne’s accessories. Whether you’re looking to scan faster, reduce glare, remove blurriness, or protect your physical copies, Photomyne apps pair wonderfully with these additional tools. Our apps         Photomyne Photo Scan app Our flagship and first app. In addition to high-quality photo scanning, it offers advanced management, editing, and backup options. SlideScan app By Photomyne The only way to digitize photo slides from your smartphone. Convert slides to digital photos with SlideScan, then transfer photos to the Photomyne app to arrange photos in albums and to add details. Filmbox app By Photomyne Turn your smartphone into a private darkroom. Convert film negatives to digital photos then transfer them to the Photomyne app to arrange photos in albums and to add details. Colorize app By Photomyne Breathe color & a new life into old black and white photos. Simply scan or upload photos and watch your photos magically colorized.",40.0,40.0,1225,10634,4.4,200.0,"Arts, Crafts & Sewing",5,China
232,"Prang Washable Glue Stick, Clear.74 Oz, 1 Count",Uni¦¦¦Now¦¦¦,"Prang 0.74 oz Glue Stick dries clear, wrinkle free and is washable, odorless, Non-Toxic and ideal for children.",2.15,1.59,180,54046,4.2,,"Arts, Crafts & Sewing",98,
263,"Scissors, Rkqoa 8"" Scissors All Purpose 6 Pack - Comfort-Grip Sharp Scissors for Office School Sewing Fabric Craft Desk Supplies, Classroom Must have, Teacher/Class Scissors, Right/Left Handles",Rkqoa,"All Purpose Soft Grip Sharp Scissors   Definitely Worth Having the Office School Household Scissors Designed for both right and left-handed Scissors   Ergonomic handle design and injection molding process. Suitable for office scissors, school scissors, sewing scissors, craft scissors, fabric scissors, household scissors, garden scissors, craft shears, left handed scissors, older kids scissors, classroom scissors, students scissors, teachers scissors, adult scissors etc.       All-Purpose Cutting Cut a wide variety of materials, including paper, photos, cardboard and more in the home, school, office and diy craft. Long-lasting sharpness Stainless steel blades hold their sharp edge for lasting effect. Comfortable to hold and use Different Colored Scissors, Can Be Used In Different Places. Great for most regular home office desk classroom school teacher household tasks. Titanium Scissors, Rkqoa 8"" All Purpose Scissors Pack of 6 - High Performance... Pink Scissors, Rkqoa 8"" All Purpose Scissors Pack of 6 - High Performance and... Purple Scissors, Rkqoa 8"" All Purpose Scissors Pack of 6 - High Performance a... 24 Black Scissors Bulk, Rkqoa 8"" All Purpose Scissors Pack - High Performance... Black-Pink Scissors Bulk, Rkqoa 8"" All Purpose Scissors Pack of 6 - High Perf... White Scissors, Rkqoa 8"" All Purpose Scissors Pack of 6 - High Performance an... Add to Cart Add to Cart Add to Cart Add to Cart Add to Cart Add to Cart Customer Reviews 4.7 out of 5 stars 56 4.7 out of 5 stars 56 4.7 out of 5 stars 56 4.7 out of 5 stars 56 4.7 out of 5 stars 56 4.7 out of 5 stars 56 Price $11.99$11.99 $9.99$9.99 $8.99$8.99 $24.99$24.99 $7.99$7.99 $9.99$9.99 Easy To Hold ? ? ? ? ? ? Easy To Use ? ? ? ? ? ? Heavy Duty ? ? ? ? ? ? Stainless Steel ? ? ? ? ? ? Suitable Ages ages 8+ ages 8+ ages 8+ ages 8+ ages 8+ ages 8+",16.0,8.99,551,380,4.6,3000.0,"Arts, Crafts & Sewing",10,China
338,"Acrylic Paint Brush Set, 1 Packs / 10 pcs Watercolor Brushes Painting Brush Nylon Hair Brushes for All Purpose Oil Watercolor Painting Artist Professional Kits",AROIC,"11.8in wood easel 6 Pack 9 Inch Wood Easels, Easel Stand for Painting Canvases, Art, and Crafts... AROIC 3pack 14'' Tabletop Easel, Black Steel Table Top Easels for Display, Sm... 3 Pack 15 Inch Wood Easels, Easel Stand for Painting Canvases, Art, and Craft... Add to Cart Add to Cart Add to Cart Add to Cart Customer Reviews 4.4 out of 5 stars 1,027 4.6 out of 5 stars 304 4.3 out of 5 stars 187 4.4 out of 5 stars 673 Price $11.84$11.84 $14.99$14.99 $14.23$14.23 $12.74$12.74 material WOOD WOOD Metal WOOD number 4P 6P 3P 3P brand AROIC AROIC AROIC AROIC",3.99,3.99,2439,3583,4.7,600.0,"Arts, Crafts & Sewing",51,China
342,"Nicpro 120 PCS Hobby Blades Set SK-5, Utility #11 Art Blades Refill Cutting Tool with Storage Case for Craft, Hobby, Scrapbooking, Stencil",Nic¦¦¦,"About NicPro Nicpro mainly focuses on Art & Office Product. We are dedicated providing more high quality tools for artists, students, office worker and everyone who is trying to steer the way Nicpro Hobby Blades 120 PCS Blades in storage case This Nicpro Hobby Blades are the ideal tool for craftsmen, hobbyists, artists and professionals alike.Designed specifically to make precise, accurate cuts in light, medium materials. Blade material :SK-5 Stainless steel 25° blades angle more sharper Durable, lightweight and rust-resistant Blades Size:#11       SK-5 Stainless steel Made of SK-5 Stainless steel, #11 fine point blade for better cuts.Durable, lightweight and rust-resistant. Easy-swap blade system 1. Unscrews the tip of your knife to unlock the blade and take out the dull razor.2. Swap out to lock the new blade in place and tighten it back up. Durable & Sharp Metal threaded anti-skidding knife with #11 Blades will provide you with reliable, consistent sharp cuts, day after day and save Times & Money       120 Pack #2 Blades 123 Pack Blades & Knifes 115 Pack Blades & Knifes Add to Cart Add to Cart Buying Options Customer Reviews 4.7 out of 5 stars 2,293 4.7 out of 5 stars 885 4.7 out of 5 stars 810 Price $11.99$11.99 $10.99$10.99 — Blades Size #11 #11 40pcs #11, 10pcs #2, 5pcs #7, 5pcs #10, 5pcs #16, 5pcs #17, 5pcs #18, 5pcs #19, 5pcs #22, 5pcs #24 Knife Size #1 #1 #2 and 9mm utility knife Blades Material SK-5 Carbon Steel SK-5 Carbon Steel SK-5 Carbon Steel",9.99,9.99,2293,5478,4.7,600.0,"Arts, Crafts & Sewing",15,China
347,"Artecho 24 PCS Paint Brushes for Acrylic Painting, Acrylic Paint Brushes for Oil, Watercolor, Acrylic, Gouache and Canvas Painting",ART¦¦¦O,"Premium nylon hair and nice aluminum ferrule   The handles of these brushes are birch wood   Different size paint brush   Waterproof case Artecho Together in art Founded in 2019, we’re a professional brand of art and painting supplies. It has successively built production bases for art supplies at home and abroad, established integrated production and sales channels, and brought professional, cost-effective products to you! The video showcases the product in use.The video guides you through product setup.The video compares multiple products.The video shows the product being unpacked.   Artecho acrylic paint acrylic paint 4.05oz Add to Cart acrylic paint 2oz Add to Cart acrylic paint 17oz Add to Cart metallic acrylic paint Add to Cart glow & neon acrylic paint Add to Cart glow & neon acrylic paint Add to Cart Customer Reviews 4.7 out of 5 stars 4,958 4.7 out of 5 stars 31 4.7 out of 5 stars 198 4.7 out of 5 stars 4,958 4.2 out of 5 stars 2,632 4.0 out of 5 stars 1,925 Price $6.99$6.99 $27.99$27.99 $54.99$54.99 $18.99$18.99 $19.99$19.99 $9.99$9.99 Colors 26 24,48 12 8,12 8 8 Volume 120ml/4.05oz 2oz 500ml/17oz 2oz, 4.05oz 59ml/2oz 20ml Type primary, metaliic, glow primary primary metallic glow, neon glow, neon Non-toxic ? ? ? ? ? ? Acid-free ? ? ? ? ? ? Artecho acrylic medium flow medium 8oz Add to Cart flow medium 32oz Add to Cart flow medium 64oz Add to Cart gesso 16.9oz Add to Cart gesso 64oz Add to Cart Customer Reviews 4.5 out of 5 stars 523 4.5 out of 5 stars 523 4.5 out of 5 stars 523 4.8 out of 5 stars 13 4.8 out of 5 stars 13 Price $8.99$8.99 $18.99$18.99 $26.99$26.99 $15.99$15.99 $29.99$29.99 Volume 8oz 32oz 64oz 16.9oz 64oz Type flow medium flow medium flow medium gesso gesso Item Form Liquid Liquid Liquid Paste Paste Non-toxic ? ? ? ? ? Acid-free ? ? ? ? ?",22.0,16.0,2866,3271,4.6,1000.0,"Arts, Crafts & Sewing",49,China
359,"Westcott 15968 Right-Handed Scissors, Kids' Scissors, Ages 4-8, 5-Inch Blunt Tip, Blue",Ama¦¦¦.co¦¦¦,"These 5-inch blunt scissors are specially designed for a child's hand. Complete with molded, asymmetrical handles for increased comfort and control, these cute scissors allow for right-handed use. Stainless steel blades make these school scissors both accurate and dependable. The perfect scissors for school kids, these mini scissors cut through paper, fabric, string, and other craft materials easily. Westcott is dedicated to supporting education and inspiring creative activities in the classroom and at home. Westcott products, including our preschool scissors, are specifically designed for growing students and created to be fun and functional with superior quality and exceptional value.",3.95,3.2,6588,1622,4.6,600.0,"Arts, Crafts & Sewing",34,China
361,"Mr. Pen- Paint Brushes, 10pc, Paint Brushes for Acrylic Painting, Art Brushes, Drawing and Art Supplies, Paint Brush, Acrylic Paint Brushes, Paint Brushes for Kids, Paint Brush set, Watercolor Brushes",Mr.¦¦¦n,"Mr. Pen Paint Brushes Paint Brushes Add to Cart Paint Brushes Add to Cart Paint Brushes Add to Cart No Spill Paint Cups Add to Cart Paint Brushes Add to Cart Paint Brush Add to Cart Paint Brush Add to Cart Customer Reviews 4.6 out of 5 stars 2,923 4.2 out of 5 stars 337 4.7 out of 5 stars 786 4.6 out of 5 stars 243 4.3 out of 5 stars 2,196 4.5 out of 5 stars 1,408 4.5 out of 5 stars 1,408 Price $4.85$4.85 $5.99$5.99 $6.59$6.59 $7.99$7.99 $5.99$5.99 $4.85$4.85 $9.85$9.85 Quantity 10 8 9 8 6 1 1 Quality Plastic Plastic Plastic Plastic Plastic Wood Wood Suitable For Acrylic Painting ? ? ? ? ? ? ? Suitable For Water Color ? ? ? ? ? ? ? Suitable For Chalk Paints ? ? ? ? ? ? ?",4.85,4.85,2923,5784,4.6,2000.0,"Arts, Crafts & Sewing",72,China
382,"Filbert Paint Brushes Set, 12 PCS Artist Brush for Acrylic Oil Watercolor Gouache Artist Professional Painting Kits with Synthetic Nylon Tips White",GET¦¦¦N A¦¦¦Sup¦¦¦¦¦¦,"FILBERT SHAPE NYLON PAINT BRUSHES 12pcs of different sizes. Model 1# 2# 3# 4# 5# 6# 7# 8# 9# 10# 11# 12#, Filbert Paint Brushes Set, 12 PCS Artist Brush The set of brushes include 12pcs of different sizes. Model 1# 2# 3# 4# 5# 6# 7# 8# 9# 10# 11# 12#, Apply to oil, acrylic, watercolor, art painting, face painting, miniatures, detailing, craft art painting, model, etc.       Nylon brushes are secured with high quality aluminum crimped ferrules. Durable brushes won’t loosen or fall apart - built to last. The artist filbert head brushes are made of finest quality of soft synthetic bristles with white short wooden handles. Perfect Gifts for Halloween, Christmas, Thanksgiving, Birthday Present, Graduation, Valentine's and Easter Day. Perfect for all sorts of art paints, handmade filbert head nylon brushes work great for watercolor, oil, acrylic painting, special effects makeup, face painting / miniature, model, craft, rock painting, etc   EASY CARE & RESHAPE Simply clean brushes with warm water immediately after use (or follow paint manufacturer’s instructions) and reshape brush tip. Store in our plastic storage container after thoroughly dry until the next painting project   Filbert Paint Brushes Set, 12 PCS Artist Brush Artist Brush for Acrylic Oil Watercolor Gouache Artist Professional Painting Kits with Synthetic Nylon Tips Filbert Paint Brushes Set of 12 Calligraphy Pens,Hand Lettering Pens, Calligraphy Brush Pen set of 8 Paint Brushes Set of 14 Watercolor Paint Set of 48 Colors Micro-Pen Fineliner Ink Pens of 12 12 Pack Drawing Pencils Add to Cart Add to Cart Add to Cart Add to Cart Add to Cart Add to Cart Customer Reviews 4.6 out of 5 stars 1,381 4.6 out of 5 stars 429 4.7 out of 5 stars 2,697 4.7 out of 5 stars 768 4.4 out of 5 stars 543 4.7 out of 5 stars 290 Price $7.99$7.99 $7.94$7.94 $8.97$8.97 $6.97$6.97 $8.99$8.99 $5.99$5.99 Applications Drawing, watercolor, oil, acrylic painting, special effects makeup, face painting / miniature, model, craft, rock painting calligraphy practicing, writing, hand lettering, art drawings, signature, design, outlining, doodling,drawing,sketch Drawing, watercolor, oil, acrylic painting, special effects makeup, face painting / miniature, model, craft, rock painting Watercolor painting, sketching, writing, drawing Drawing and Shading, Shading Pencils for Sketching Good for Mixed Media ? ? ? ? ? ? Artist of all Levels ? ? ? ? ? ?",17.0,8.97,2697,2695,4.7,1000.0,"Arts, Crafts & Sewing",43,China
418,"Pro Grade - Chip Paint Brushes - 96 Ea 2 Inch Chip Brush for Paints, Stains, Varnishes, Glues, & Gesso",Pro¦¦¦ade¦¦¦ppl¦¦¦¦¦¦,"Pro Grade Chip Paint Brushes Pro Grade Chip Paint Brushes Pro Grade Chip Paint Brushes Pro Grade Chip Paint Brushes Pro Grade Chip Paint Brushes Add to Cart Add to Cart Add to Cart Add to Cart Add to Cart Customer Reviews 4.4 out of 5 stars 866 4.4 out of 5 stars 1,817 4.4 out of 5 stars 839 4.5 out of 5 stars 519 4.5 out of 5 stars 164 Price $6.99$6.99 $11.99$11.99 $17.99$17.99 $16.99$16.99 $24.99$24.99 Brush Size 1"" 1"" 1.5"" 2.5"" 4"" Quantity 12 Pack 24 Pack 36 Pack 24 Pack 24 Pack",45.0,34.0,1194,2073,4.6,1000.0,"Arts, Crafts & Sewing",34,
447,"Falling in Art Soft Linoleum Carving Block, Linocut Block for Printmaking, 8 Inches by 10 Inches, Gray, 2-Pack",You¦¦¦ele¦¦¦on,The video showcases the product in use.The video guides you through product setup.The video compares multiple products.The video shows the product being unpacked.   Soft Safety Material ideal to engrave delicate patterns and stamp on your handicrafts for a long time.   Cut into varisized smaller Can be cut into varisized smaller rubber sheets.,15.0,15.0,887,7086,4.5,200.0,"Arts, Crafts & Sewing",2,China
491,Transon Artist Paint Brush Set of 12 for Watercolor Acrylic Gouache Oil and Tempera Painting,TRA¦¦¦N,"This series of paint brushes are hand-crafted premium set, and they are also practical. They are perfect for canvas painting, body painting, rock painting, craft painting, decoration painting, etc. A range of brush sizes is important to accommodate different painting needs and scales: Flat: 3, 7, 12 Filbert: 8, 10 Angled: 4, 7, 11 Round: 5, 9 Liner: 1, 2 Overall length: #1 20.7cm #2 20.3cm #3 20.3cm #4 20.4cm #5 20.9cm #6 21.5cm #7 21.6cm #8 22cm #9 22.3cm #10 22.6c #11 23cm #12 23cm       Transon synthetic bristles Transon synthetic bristles are great choice for multi-medium brushes as they are durable, resilient, and can withstand the different painting medium. They are also easier to clean and maintain. Professional Bristles that are with well balanced density that allows for control and smooth application across different mediums like acrylic, oil, gouache, watercolor.Brushes with a variety of shapes, such as round, flat, filbert, angular, and rigger, allow for versatility in different painting techniques and styles. Comfortable Ergonomically designed handles are comfortable to hold for extended periods of use and provide a secure grip, they also reduce hand fatigue for longer painting sessions.   Care Your Brushes Clean the brushes right after use by soaking in lukewarm soap water (Do not use hot water!) and rinse well. Gently reshape the bristles with fingers, let dry first in room-temperature(Do not rest the brushes on their hairs!). Premium & Professional Premium Brush Set Premium nylon, dual color, high flexibility, great water absorbency, carries a fare amount of paints.Ergonomic handle, medium size, smooth touch, comfortable grip, .Cold black, high-intensity aluminum ferrules, sturdy and durable. Assorted & Versatile Assorted tips including: round, liner, flat, filbert, angle. Works with different media: Watercolor, Acrylic, Oil, Tempera, Gouache, etc. Transon Professional Artist Paint Brush Set 12-pack     24color Acrylic Paint Kit with 12 Assroted Brush Set and 1 Paint Palette Paint Brush Kit 16 Paint Brushes with Foam Brush Sponge Spatula and Brush Case Transon Paint Brush Kit 10pcs Art Brushes and 1 Paint Spatula with Brush Case 20pcs Art Painting Brush Set Transon 14pcs Art Painting Brush Set for Acrylic, Watercolor and Oil Painting Transon 12colors Face Painting Kit for Kids Adults Non-toxic Water-based Paint Add to Cart Buying Options Add to Cart Add to Cart Add to Cart Add to Cart Customer Reviews 4.6 out of 5 stars 313 4.7 out of 5 stars 5,204 4.6 out of 5 stars 464 4.6 out of 5 stars 1,791 4.6 out of 5 stars 128 3.6 out of 5 stars 48 Price $15.99$15.99 — $12.99$12.99 $6.99$6.99 $7.99$7.99 $8.99$8.99 Count 24 20 12 20 14 N/A",13.0,13.0,5204,1060,4.7,3000.0,"Arts, Crafts & Sewing",17,China
