,title,seller_name,description,initial_price,final_price,reviews_count,root_bs_rank,rating,bought_past_month,root_bs_category,bs_rank,country_of_origin
502,"miisso 10000mAh Slim Portable Charger with Built in Cable, Power Bank Travel Charger External Battery Pack for Phone, 4 Output USB Type C Cord Clutch Charger Compatible with iPhone, Black",Mii¦¦¦Dir¦¦¦,"Previous page Next page 1 Charge for iPhone 14 & 15 2 Fully Charge 3 3A Speed Charge 4 Built with Cable You need 5 Protect System     Charing Your Phone on Airplane This power bank is 37Wh, it is fully compliant with international aviation regulations and you can carry it on board.   Charging Your Mini Fan There is a USB output(5V/2.4A) on this power bank, and it can charge your mini fan by your cable. Previous page Next page   Miisso Power Banks Comparison 10000mAh Power Bank (New) Add to Cart 6000mAh Power Bank Add to Cart 10000mAh with AC Plug Add to Cart 4500mAh Power Bank Buying Options Customer Reviews 4.3 out of 5 stars 1,316 4.3 out of 5 stars 10,159 4.7 out of 5 stars 276 4.2 out of 5 stars 54 Price $32.99$32.99 $30.99$30.99 $39.99$39.99 — Cell Capacity 10000mAh 6000mAh 10000mAh 4500mAh Built in Cable Lightning Cable + USB-C Cable Lightning Cable + USB-C Cable Lightning Cable + USB-C Cable Lightning Cable Compatibility iPhone+Airpods+Android Devices iPhone+Airpods+Android Devices iPhone/Airpods/Android Devices iPhone+Airpods Charge for iPhone 15/14 2~3 charges 1 charge 2~3 charges 1 charge Output Port 2 USB-C + 1 USB A +1 Lightning 2 USB-C + 1 USB A +1 Lightning 2 USB-C +1 Lightning 1 USB-C + 1 USB A +1 Lightning input Port Type C & Micro Type C & Micro Type C & AC Plug Type C Size/Inch 5.59*2.75*0.57 4.13*2.6*0.51 4.96*2.67*0.7 3.98*2.7*0.55 Weight 0.44lb 0.25lb 0.36lb 0.33lb",36.0,33.0,1316,512,4.3,1000.0,Cell Phones & Accessories,45,
507,"COOLQO Compatible for iPhone XR Case, with [2 x Tempered Glass Screen Protector] Clear 360 Full Body Coverage Hard PC+Soft Silicone TPU 3in1 [Heavy Duty Shockproof Defender] Phone Protective Cover",COO¦¦¦,"SUPPORT WIRELESS CHARGING With efficient wireless charging transmission, this TPU back leaves wireless charging unaffected.   2 PACKS OF TEMPERED GLASS SCREEN PROTECTOR COOLQO offers TWO Tempered Glass Screen Protector, Arc edge design features an oleophobic coating that resists oils, preventing undesired fingerprints that can interfere with using the device, Bubble-free during application, Easy to install and remove. (1 protector for use & 1 protector for backup)   Step1: Separate front frame from back cover prior to installation. Find the rim seam where two edges of front bumper and back cover meet and take the front and the back apart. Q: What’s the use of the rim seam where two edges meet? A: It’s designed for letting the front bumper properly and snugly nestled in the back cover, to provide best possible protection against drops. Step2: Install the hard PC front frame. Please set the top side (front camera side) around the iPhone first, and then attach the bottom side (charging port side). ** Top to bottom installation is crucial for proper fitting of the front piece. DO NOT install the front piece from bottom to top. Q: Can I install the front piece from the bottom side to the top side? A: No! Our phone case is not designed to be installed in this order of steps. You will be unable to install the front bumper starting from the bottom side, finishing with the top side. You must follow the order of steps through our instructions. Step3: Install the soft TPU back cover. Snap the front piece tightly into place with the back cover. Q: I feel it is a little tight to install the back cover. Is it normal? A: Yes,it is normal. As both the front bumper and the back cover are designed, through high gloss finish manufacturing process and the electrostatic drag occurs when the case is installed to fit the iPhone, you may first need to give a little more physical force at installation. With the proper steps, a final, snug fit should result. Step4: Make sure you align the edges of the front piece and the back piece, and then gently press the rim seam to let the front bumper properly and snugly nestled in the back cover. Q: How to quickly install this 3in1 case? A: A 3in1 case such as this may occasionally require a few attempts at installation to get the hard bumper and the silicone cover to sit just right together. If you feel it is hard to install the case at first, please remove the case and re-install it. A few attempts may help to make installation easier, for a best, final fit. Step5: Install the tempered glass protector piece onto the iPhone screen. Q: Must I install both tempered glass protectors onto the iPhone screen at the same time? A: No! We offer two pieces of tempered glass screen protectors, one for the instant use and the other one for the backup.",9.99,9.99,41812,1372,4.4,1000.0,Cell Phones & Accessories,22,China
510,"SPIDERCASE Magnetic for iPhone 16 Pro Case, with 2 Pcs [Tempered Glass Screen Protector] [ Military Grade Drop Protection] Invisible Kickstand Slim Case for iPhone 16 Pro 6.3"", Clear",MOU¦¦¦one¦¦¦,The video showcases the product in use.The video guides you through product setup.The video compares multiple products.The video shows the product being unpacked.   Previous page Next page       Previous page Next page,20.0,18.0,920,431,4.4,1000.0,Cell Phones & Accessories,150,China
514,"Homsctect Upgraded for MagSafe Wallet, Magnetic Phone Wallet 3 Cards Holder, Powerful 23 Magnets&Credit Card RFID Blocking, Slim&Leather, Magnetic Wallet for iPhone 16/15/14/13/12 Series-Rose Gold",Ela¦¦¦feU¦¦¦,"Magnetic Case/ Magnetic Ring Compatible Phone Models iPhone 16 Pro Max/iPhone 16 Pro/iPhone 16/iPhone 16 PlusiPhone 15 Pro Max/iPhone 15 Pro/iPhone 15/iPhone 15 PlusiPhone 14 Pro Max/iPhone 14 Pro/iPhone 14/iPhone 14 PlusiPhone 13 Pro Max/iPhone 13 Pro/iPhone 13/iPhone 13 MiniiPhone 12 Pro Max/iPhone 12 Pro/iPhone 12/iPhone 12 Mini     Strongest Magnetic Force Never Falling off from Shaking Built-in 23 ultra strong N52 magnets ensure strongest magnetic force, compatible with magsafe wallet",13.0,9.99,31,5100,5.0,50.0,Cell Phones & Accessories,53,China
517,"APPS2Car Gym Magnetic Phone Holder, 360 Adjustable, Compatible with 4.7-6.5"" Smartphones, Alloy Base and Joint, Black",Gen¦¦¦,"MagSafe Gym Phone Holder Gym Phone Holder Lid for Hydro Flask Wide Mouth with MagSafe Phone Mount Add to Cart Add to Cart Add to Cart Customer Reviews 4.6 out of 5 stars 40 4.7 out of 5 stars 262 5.0 out of 5 stars 3 Price $19.99$19.99 $19.99$19.99 $15.99$15.99 Compatibility iPhone 12 Series and above All 4.7-6.5"" Smartphones iPhone 12 Series and above Application Metal Surface Metal Surface HydroFlask With Mouth Bottles Special Features Solid Metal Base; 360-Degree Rotation Solid Metal Base; 360-Degree Rotation Strong Magnets; Leak-proof         About Our Brand For us, being a leading designer and manufacturer of products is not enough. APPS2Car aims to ensure our customers have an unprecedented, reliable and fun experience We don’t design products based on market interest; we develop tools and products based on real-life needs and expectations for a new kind of life, through innovation and customer feedback APPS2Car Gym Accessories --Gym Magnetic Phone Holder At APPS2Car, we make your workouts more enjoyable, effective, and convenient This magnetic phone holder is specially designed for fitness enthusiasts. The product is designed to be simple, low-key yet elegant, easy to use, and easy to carry It can be tightly attached to any iron metal surface. For many daily situations, you need it such as everyday fitness, working metal shelves, etc All Metal Base and Ball Jiont 6*N52 Strong Magnets 360 Degree Rotation for Video Recording Rubber Coated Base and Clamp Arm Avoiding Scratches       All Metal Base and Ball Head Superior aluminum-alloy construction, Strong and durable, and not easy to break. It fixes your cellphone into place at any viewing angle 6 * N52 Strong Magnets Made from 6 extra strong magnets that can exert 50 pounds of pulling force. It will stick firmly to any iron surface Universal & Portabal Phone Holder The spring clamp can be extended up to 3.3 inches wide, it is compatible with all iPhone and almost all Android phones with or without a case",20.0,20.0,262,1930,4.7,2000.0,Cell Phones & Accessories,84,China
540,"Goton Waterproof Case for Galaxy Watch 6 Screen Protector 44mm, [No Fog] Tempered Glass Face Cover for Samsung Watch 6 Accessories 44 mm Black",Yin¦¦¦ton¦¦¦tho¦¦¦¦¦¦,"Discover more products Watch 6 Screen Protector Add to Cart Watch 6 Classic Protector Add to Cart Watch 5 & 4 Protector Add to Cart 20mm Bling Thin Band Add to Cart 20mm Bling Band Add to Cart Watch 4 Classic Protector Add to Cart Watch 3 Protector Add to Cart Customer Reviews 3.8 out of 5 stars 352 4.2 out of 5 stars 287 4.2 out of 5 stars 1,141 4.4 out of 5 stars 1,438 4.4 out of 5 stars 1,438 4.3 out of 5 stars 2,047 4.4 out of 5 stars 2,085 Price $9.99$9.99 $9.99$9.99 $9.99$9.99 $11.99$11.99 $11.99$11.99 $9.90$9.90 $11.99$11.99 Compatible Models Samsung Galaxy Watch 6 Only Galaxy Watch 6 Classic Only Samsung Galaxy Watch 5 & 4 All watches with 20mm lugs All watches with 20mm lugs Galaxy Watch 4 Classic Only Samsung Galaxy Watch 3 Only Feature Inlaid with bling rhinestones 3-in-1 (case+ring+protector) Special electroplating process Slim thin strap design Special glitter silicone band 3-in-1 (case+ring+protector) 3-in-1 (case+ring+protector) Feature Touch sensitive Shockproof protection Inlaid with bling rhinestones Perfect for dressy Color changes with angle Shockproof protection Shockproof protection Feature Scratch resistant Scratch resistant Touch sensitive Suitable for small wrists Suitable for small wrists Scratch resistant Scratch resistant Package 3 pack 1 set 1 pack 1 * strap 1 * strap 1 set 1 set     Previous page Next page 1 2 3",9.99,7.99,736,951,4.2,500.0,Cell Phones & Accessories,15,China
545,"Wireless Camera Remote Shutter for Smartphones (2 Pack), zttopo Wireless Phone Camera Remote Control Compatible with iPhone/Android Cell Phone - Create Amazing Photos and Selfies, Wrist Strap Included",Ztt¦¦¦® U¦¦¦,"Wireless Bluetooth Selfie Remote Control for Smartphones with Wrist Straps 2 Pack   The Zttopo Bluetooth camera remote will enhance your photo-taking experience, whether you're a photographer, content creator, presenter, or simply looking to make your photo or video taking more convenient, the remote offers a practical and efficient solution. It is a must-have product in your life.       Samll and Lightweight the Bluetooth remote is small enough to keep on a keychain or in your pocket. also, it comes with an adjustable hand strap. you can bring it to any outdoor activity. Enough Control Distance Operational up to 30 feet / 10 meters, the remote shutter can provide you with more photo-creative ideas. Easy Operate after connecting with the photo clicker. Just open your phone camera and click the button to take the photo.     How to use 1, Turn on the remote by switching the on/off button(at the right side of the remote), you will see a blue LED light flashing, 2, Active BT function on your phone and search for the new device. 3, select the device ""AB Shutter3"" from the list and the pairing will be finished in a few seconds. 4, open your phone camera and enjoy your picture time. Note: For most devices, there is no app download necessary, the remote will pair with your device via BT. For Sony Xperia S, HTC One, and X+ users, Please download the ""Camera 360"" app in the google play store, then connect to use.",8.99,8.99,8072,3473,4.5,1000.0,Cell Phones & Accessories,16,China
553,"INIU Portable Charger, Smallest 22.5W 10000mAh Power Bank, USB C in/Output Fast Charging 3-Output Mini Battery Pack Charger with Phone Holder for iPhone 16 15 14 13 12 Samsung S23 Google iPad Tablet",Ama¦¦¦.co¦¦¦,"The Market's Smallest 10,000mAh Power Bank   Previous page Next page 1 USB-C Fast Charge 2 USB-A Fast Charge 3 USB-C Fast Recharge 4 For Gamers 10,000mAh Palm Power for Multiple Charges On the Go   IMPORTANT NOTES: The usable capacity of power bank may vary from the rated one due to energy conversion (typically 85-92%) and circuit losses (typically remaining 65-74%). This is common for all power banks. *(Powerbank Rated Capacity × 90% × 74%)/Device Battery Capacity˜Number of Charges Previous page Next page Tailor-made for Your Daily Schedule 1 Gathering 2 Air Travel 3 Hotel Overnight Wide Compatibility     Pull-Out Phone Holder Our unique design includes a built-in phone holder. Simply pull it out to charge and watch videos simultaneously, freeing your hands completely.   3-Year iNiu Care iNiu offers a 3-year product care. If you have any issues, we will send you a new one. Smallest USB C Power Bank Comparison 1.4 Charges iPhone 15 Pro Max 2.7 Charges 1.8 Charges iPhone 14 3.7 Charges 1.2 Charges Samsung S24 2.4 Charges 0.8 Charge iPad Pro 1.5 Charges 4.1*2.6*0.9in Size 5.3*2.8*1.0in 6.9oz/195g Weight 12.8oz/365g 1.4 Charges iPhone 15 Pro Max 2.3 Charges 1.8 Charges iPhone 14 2.7 Charges 1.2 Charges Samsung S24 1.8 Charges 0.8 Charge iPad Pro 0.9 Charge 4.1*2.6*0.9in Size 5.7*2.8*0.9in 6.9oz/195g Weight 11.7oz/334g 1.4 Charges iPhone 15 Pro Max 3.4 Charges 1.8 Charges iPhone 14 4.6 Charges 1.2 Charges Samsung S24 3.0 Charges 0.8 Charge iPad Pro 1.6 Charges 4.1*2.6*0.9in Size 5.85*2.87*1.34in 6.9oz/195g Weight 16.7oz/475g Previous page 20000mAh 22.5W Power Bank 20000mAh 65W Power Bank 25000mAh 100W Power Bank Next page Learn More Learn More Learn More",25.0,21.0,25628,385,4.6,9000.0,Cell Phones & Accessories,30,China
558,"UBeesize Phone Tripod, Premium Flexible Phone Tripod with Remote and Phone Mount, Mini Tripod Stand for Camera, GoPro",Ama¦¦¦.co¦¦¦,Previous page Next page   Previous page Next page 1 Vlog 2 Record 3 Live 4 Selfie 5 Photography,15.0,12.5,30596,1234,4.4,2000.0,Cell Phones & Accessories,15,
560,"USB C Female to USB Male Adapter (4-Pack),Type C to USB A Charger Cable Adapter for iPhone 11 12 13 14 15 Pro Max,Samsung Galaxy S24 S23 S22 Ultra,Google Pixel 7 6 5,iWatch Watch Series 7 SE,AirPods",Qia¦¦¦nk,"QianLink USB-C female to USB-A Male adapter(Only for charging or data transfer) Part of the functional limitations: CAN NOT output video (HDMI, VGA, DP or other types of video signal)This product cannot be used with MagSafe wireless chargers(So MagSafe charger must be paired with A USB-C power adapter)This is a USB 2.0 adapter, CAN NOT support USB 3.0/3.1 protocol(Unable to reach 5Gbps transmission speed) What You Get We provide 4 × USB-C (female) to USB-A (male) adapter,Applicable to a variety of scenarios, such as living room, room, office, car, etc. Compatible Devices (Including but not limited to) Apple Watch iWatch Series 7 8 SEiPhone 16 15 14 13 12 11 Mini Pro Max SEAirPods Pro, AirPods 1st 2nd 3rd GenerationSamsung Galaxy S24 S23 S22 S21 S20 Plus Ultra, Note 10 20iPad Pro, iPad 8 8th 9 9th Generation Air 4 4th Generation 2020 Mini Gen 6 2021Google Pixel 6 5 4 4a 3 3A 2 XL     Convert USB port to USB-C port By inserting the adapter into an available standard USB port, it can become a USB-C port.adapter supports up to 3A charging speed. Please be noted the charging speed mainly decided by the cable and charger.   Easy to carry Our aluminum-alloy-bodied dongle occupies very little space and can plug directly onto the end of your USB-A hardware, so you won’t have to worry about carrying it around.   Fast data transfer This adapter offers data transfer speeds of up to 480 Mbps between connected devices.   High-quality chip & excellent design The adapter has a built-in 56KO resistor to ensure safe and long-lasting charging and data transmission           Easy and fast lightning-USB C Charging Cord Connect USB A Charger",7.99,7.99,26638,7063,4.6,100.0,Cell Phones & Accessories,53,China
562,"Stylus Pens for Touch Screens 5 Pack, Stylushome Dual-end High Sensitivity Capacitive Stylus for iPad, iPhone, Android Smartphone and Tablets All Universal Touchscreen Devices with 10 Rubber Tips",Sty¦¦¦Hom¦¦¦,"This upgraded gradient macaron color 5-pack touchscreen stylus will make an ideal Christmas/birthday/back-to-school/office gift for family or friends. Previous page Next page Perfect for Daily Use Previous page Next page Find Your Color   Replacement Tips   Universal Compatibility   What if the stylus pen for ipad doesn't work on the iPad? Please disconnect your iPad from the Apple pencil first, and if there is a switch inside the app for Apple pencil use only, please turn it off. If you have any questions about this stylus, please let us know via Amazon message/email. Is this stylus an ink pen and can it be written on paper? This macaron color stylus does not have a refill or a fine nib, this stylus consists of 2 different size rubber tip, please check the tip details in the pictures and confirm your needs before purchasing. Will this capacitive stylus scratch the screen? Normally our touchscreen stylus won't cause scratches on a touch screen, but we still suggest you use a screen protector on your device to protect the screen from any possible damage/scratches. Does this iPhone stylus support palm rejection function? This stylus does not support palm rejection, please make sure your hands do not lay on the screen. Why doesn't this ipad stylus work on notability? Please modify your settings in the app to use it. Click ""Info"" in Notability - find ""Apple Pencil:"" - select ""Disconnect"", then you can use it normally. Other applications where the stylus doesn't work can refer to this operation. (GoodNotes/Note)",13.0,9.99,1458,2096,4.7,2000.0,Cell Phones & Accessories,46,China
568,"HiWe for MagSafe Wallet with Find My Built in, Trackable Magnetic Card Holder for iPhone 16/15/14/13/12 Series, Not for Android, Vegan Leather, Fit 4 Cards, RFID Blocking, Black",Hiw¦¦¦ire¦¦¦,"Previous page Left-behind Remind Turn on Left-behind Remind on Find My App. Get notifications if your wallet is left behind. Find Item Nearby Ring your wallet on Find My App when it's within Bluetooth range. Find Item Far Away View your wallet last location on Find My App when it's outside of Bluetooth range. Next page 1 Pairing Find My 2 Left-behind Remind 3 Find Item Nearby 4 Find Item Far Away 5 hey Siri Previous page Next page Previous page Next page 1 Strong Magnet 2 RFID-Blocking 3 Wireless Charging 4 Smart Storage 5 Pocket Friendly   1. What are the compatible mobile phone models? It is for iPhone 16/15/14/13/12 series caseless or with Mag-Safe cases. Not compatible with the Non-magnetic cases. No matter how thin the case is. Not compatible with Android phones. (For Apple iOS 14.5 or above) 2. Does this wallet have all the functions of Find My? Yes, except UWB precision finding. This product is licensed by Apple. Due to Apple's authorization restrictions on third parties, the positioning accuracy of this product is at the meter level. 3. Can the wallet charge my phone? No, the wallet battery only powers the Find My Functions, it is not a power bank and it can't charge your phone. 4. How does this wallet protect my card? RFID-Blocking to protect your card from scanning Strong Magnetic Force to keep the wallet tick firmly on the phone back. The elastic band keeps the cards from sliding off. Works with Apple Find My Network and makes your wallet traceable. 5. What should I do if my phone can't connect to this wallet? (the phone versions is iOS 14.5 or above) First, make sure your wallet is fully charged, then try to reset it, and if you still can't connect, you can get a new replacement without return. If the customer does not unbind the wallet to the Apple ID, the others will not be able to use it. The video showcases the product in use.The video guides you through product setup.The video compares multiple products.The video shows the product being unpacked.",30.0,30.0,153,6499,4.5,300.0,Cell Phones & Accessories,60,China
574,"Anker 621 Magnetic Portable Charger (MagGo), 5,000mAh Wireless Power Bank with USB-C Cable, Magsafe-Compatible Battery Pack for iPhone 16 /15/14/13/12 Series",Ank¦¦¦ire¦¦¦,"Previous page Next page 1 Compact Power 2 MultiProtect 3 Scratch Protection Why is my power bank providing fewer charges than expected? The capacity reduction during charging is due to a 30% to 45% energy loss in the battery cells and conversion circuitry. Therefore, a fully charged Anker A1610 Battery (PowerCore 5K) offers an estimated 2,750mAh~3,250mAhto power devices. How can I estimate the number of charges for my device? To estimate charging cycles, use these formula:(Power Bank Capacity × 0.5) ÷ Device Battery Capacity ˜ Number of Charges. For instance, charging a 3,000mAh device using a 5,000mAh Wireless power bank would offer approximately 0.83 charges. Why does charging stop at 80%? Your iPhone may automatically stop charging at 80% to protect its battery from overheating, as part of iOS 17's thermal management strategy. Charging will resume once the device cools down. Moving it to a cooler spot can help speed up this process. Why is my phone overheating? It's normal for devices to warm up slightly during wireless charging, particularly with heavy use like extensive gaming or streaming. Rest assured, this device meets international safety standards for safe operation. Anker Magnetic Battery Add to Cart Anker MagGo USB-C Adapter Add to Cart Anker Zolo Power Bank Add to Cart Anker Zolo Power Bank Add to Cart Anker 10K MagGo Battery Add to Cart Anker 633Magnetic Battery Add to Cart Customer Reviews 4.2 out of 5 stars 11,657 4.4 out of 5 stars 373 4.5 out of 5 stars 55 4.7 out of 5 stars 49 4.4 out of 5 stars 2,805 4.5 out of 5 stars 7,439 Price $39.99$39.99 $69.99$69.99 $49.99$49.99 $39.99$39.99 $89.99$89.99 $54.99$54.99 Series Basic Qi2 Zolo Zolo Premium High Cell Capacity Recharging Time ~2 Hours (12W) ~2 Hours (15W) ~2.5 Hours (20W) ~2.5 Hours (20W) ~ 2.75 Hours (20W) ~ 2.5 Hours (20W) Size ~2 Hours (12W) 4.09x 2.77x 0.56 inches 4.15 x 2.72 x 0.81 4.07 × 2.72 × 0.83 in 4.22 x 2.71 x 0.78 in 4.21 x 2.62 x 0.71 in Weight 129g/0.28lb 199.8g/7.05oz 8.46 oz (239g) 7.87 oz 250g/8.8oz 218g/7.7oz Weight 5,000 mAh 10,000 mAh 10,000 mAh 10,000 mAh 10,000 mAh 10,000 mAh Output Ports Magnetic, 1xUSB-C Magnetic, 1xUSB-C Magnetic, 1xUSB-C Magnetic, 1xUSB-C Magnetic, 1xUSB-C Magnetic, 1xUSB-C Compatible Devices iPhone16 /iPhone15/iphone iPhone16 /iPhone15/iphone iPhone16 /iPhone15/iphone iPhone16 /iPhone15/iphone iPhone16 /iPhone15/iphone iPhone16 /iPhone15/iphone",40.0,40.0,11657,145,4.2,10000.0,Cell Phones & Accessories,6,China
575,"Charmast Portable Charger with Built-in Cables & Wall Plug, 10000mAh Portable Power Bank, External Battery Pack Travel Essentials Compatible with iPhone 16/15/14/13, Samsung, iPad etc",Cha¦¦¦st,"Previous page Next page 1 Buit-in Cables 2 Wall-plug Integrated 3 LED Display Previous page Next page 1 Working 2 Traveling 3 Gifts   Charmast Portable Charger Power Bank Built in Cable Add to Cart Small Portable Charger Add to Cart 10000mAh Portable Charger Buying Options 20000mAh Power Bank Add to Cart 26800mAh Slim Power Bank Add to Cart 10000mAh Portable Charger Add to Cart Small Portable Charger Add to Cart Customer Reviews 4.5 out of 5 stars 2,065 4.2 out of 5 stars 6,920 — 4.2 out of 5 stars 786 4.5 out of 5 stars 4,720 4.4 out of 5 stars 689 4.2 out of 5 stars 6,920 Price $34.99$34.99 $21.99$21.99 — $45.99$45.99 $35.99$35.99 $9.99$9.99 $19.99$19.99 Capacity 10000mAh 5000mAh 10000mAh 20000mAh 26800mAh 10000mAh 5000mAh Special Features Built-in Wall Plug and Cables Lipstick Size, Fast Charging LED Display Fast Charging, Plug Integrated Slim Desigh, Huge Capacity Palm Design, Fast Charging Lipstick Size, Fast Charging Max Output 15W 20W 15W 22.5W 15W 20W 20W Size 5.95"" x 2.76"" x 0.72"" 3.03'' x 1.38"" x 0.97"" 5.67"" x 2.64"" x 0.6"" 5.91"" x 2.83"" * 1.09"" 6.39"" x 3.6"" x 0.61"" 3.95"" x 2.63"" x 0.68"" 3.03'' x 1.38"" x 0.97"" Weight 8oz 3.25oz 0.5lb 12.99oz 11.92oz 5.85oz 3.25oz How to troubleshooting the issues with this product 1) Make sure the product is fully charged with the built-in plug. 2) Press the button, when you make sure that the product is tightly connected to your device. 3) Deplete all the power of the product, and then charge it for more than 24 hours. Precautions for use Keep away from liquids, sources of ignition and high temperatures. Dispose of the battery in accordance with local environmental laws. Do not disassemble by yourself. Avoid dropping. How do you turn it off? Hitting the power button and it won’t turn off. When unplugging the phone, the display screen of the power bank will constantly light on for 35 seconds and then shut off. The power bank will shut off automatically after 2 seconds after you double-click the power button. Can this be taken on a plane? Yes, it's only 38.5Wh which allows it to take on an airplane, but you need to take it on your carry-on bags. Carry-on bags: Yes Checked on bags: No",35.0,35.0,2065,391,4.5,3000.0,Cell Phones & Accessories,32,China
579,"TAURI 2 Pack Hard Case for Pixel Watch 3 (2024)/Pixel Watch Series 2 1 41mm with 9H Tempered Glass Screen Protector, [Touch Sensitive] [Full Coverage] Slim Protective Cover for Pixel Watch 3, Clear",Tauri,Previous page Next page,13.0,7.99,519,5785,4.3,300.0,Cell Phones & Accessories,83,
